truthdogg 161212067056 "2017-05-29 20:02:06 GMT" http://truthdogg.tumblr.com/post/161212067056/crowdfunding-vs-crowdfunding "ian-wins:  truthdogg:  Why do people oppose universal healthcare and find GoFundMe drives uplifting? Clearly, their argument about planning for your own go-it-alone emergency is bullshit. Because universal healthcare pays for other ethnic and religious groups. The Constitution doesn’t require equal success of GoFundMe drives. By crowdfunding from a limited group of volunteer donors, instead of crowdfunding from a massive group of donors that even includes greedy assholes, donors can judge whether or not someone is worthy. If the donors believe the sick or injured person ate too much sugar as a child, or grew up black, they can withhold funds and hope the person dies. This shit is really simple. When people don’t believe in taxes being needed to benefit all of society, they don’t believe in a broader community. Frankly, they are denying the very idea of a nation, all to deny specific people a nation’s benefits. Ethnonationalism is not a way to build an actual nation. Its purpose is to splinter nations into isolated pockets. It is the destruction the Republican Party is attempting to force onto the rest of us.  You make this attack assuming that you have the moral high ground. You don’t. I will attempt to make this very simple. As kids we are all taught that stealing is wrong. See the definition of steal here: Definition of steal stoleplay\ˈstōl\; stolenplay\ˈstō-lən\; stealing intransitive verb 1:  to take the property of another wrongfully and especially as a habitual or regular practice 2:  to come or go secretly, unobtrusively, gradually, or unexpectedly 3:  to steal or attempt to steal a base https://www.merriam-webster.com/dictionary/steal This is one basic thing that we all learn. If you stole my money I could see you punished by law. What makes you think that having the government steal from me is different from you robbing me at gunpoint? Don’t mistake my disdain for thieves as a statement that I don’t care about those who suffer. I gladly donate to charities that I feel to be good organizations.  I am, however, deadset against the government acting as a charity. The government already can’t handle what they have on their plate. I cannot understand why people insist that we charge them with more responsibility. I get that you wish for all of the “greedy bastards” to pay their fair share. The fact is that most of them do. This idea that these big corporation heads are greedy assholes generally stems from people’s frustration with the government mishandling the money that they steal from us. Crowd funding is a beautiful thing. This allows an individual to make there own choice of who they trust their hard earned money with. By making this more readily available it could eliminate a lot of the riff-raff that take advantage of our current system. This frees up the funds to allow more efficient charity. With our current systems every dollar the government steals for “charity”. A very significant portion of the money stolen from us is lost immediately due to processing, leechers, and over spending. Is this the best way to do things? Not only is our current system both extremely immoral; it is also one of the least efficient methods of actually helping people. With crowd funding at least we know exactly where are money is going.  This is both hilarious and sad.First, taxation is not theft. It can be, for example if the government is a dictatorship, or there is no representation. That’s not the case here, and no sane person thinks it is.Crowdfunding has its place, but the conservative argument against public healthcare has been that everyone should provide for themselves. Adding in “but if they can’t they should get online and beg for money and I’ll support them” reveals the blatant lie in that entire argument.I can’t tell if you’re honestly proposing a system where “generous” people scroll through medical profiles looking for people they trust their hard-earned money with, but it sounds like you may be. “Ooh she’s hot, here’s ten bucks. Ugh, diabetes, just die already,” swipe, swipe again, is what you’re describing. (And the most generous people in this country are, and have always been, the poorest. Unless you’re talking about things like slapping names on university buildings–that’s a more expensive charity that our most wealthy really enjoy. Lots of exceptions in a big country, but that’s what the data says.)It could be like a dating app that comes pre-loaded on all phones, but most people turn off the alerts because it’s annoying to look at. The popular can promote their profiles on other media, and if your social skills are bad you can lose your home and die. Sort of like now, but with the bonus direct message of “no one likes you” on your deathbed. (I see some dystopian short fiction coming on here…)The only people who don’t see taxation as a form of organized and large-scale crowdfunding are people who want to limit their taxes from assisting specific ethnic and religious groups. That’s a fact, even if it does make some people uncomfortable to admit.But I strongly agree on one thing: our current system is extremely immoral and is one of the least efficient ways of actually helping people. It’s why every other developed nation in the world has some form of universal healthcare. It’s cheaper and more effective than our shitshow. But then not all other developed nations have our segregated social history, or mainstream politics as far to the right as ours. We still have a sizable part of our population wishing that about a third of the country would just die already. If you’re legit telling me you want to pick & choose who deserves to live or not, you must be one of them. Embrace it, you’ll feel better, and your arguments will make more sense." False text
truthdogg 161203234821 "2017-05-29 15:15:30 GMT" http://truthdogg.tumblr.com/post/161203234821/in-looking-at-my-mentions-and-messages-ive-gotta "In looking at my mentions and messages I’ve gotta say, libertarians have gotta be the dumbest people on the planet.  I do, however, appreciate (and almost enjoy) the fact that a living person could embrace such a radical utopian idea that has never been implemented anywhere in the world with anything remotely like success, and regularly call other people naive without any sense of irony." True text
truthdogg 161166811151 "2017-05-28 15:56:13 GMT" http://truthdogg.tumblr.com/post/161166811151/crowdfunding-vs-crowdfunding "Why do people oppose universal healthcare and find GoFundMe drives uplifting? Clearly, their argument about planning for your own go-it-alone emergency is bullshit. Because universal healthcare pays for other ethnic and religious groups. The Constitution doesn’t require equal success of GoFundMe drives. By crowdfunding from a limited group of volunteer donors, instead of crowdfunding from a massive group of donors that even includes greedy assholes, donors can judge whether or not someone is worthy. If the donors believe the sick or injured person ate too much sugar as a child, or grew up black, they can withhold funds and hope the person dies. This shit is really simple. When people don’t believe in taxes being needed to benefit all of society, they don’t believe in a broader community. Frankly, they are denying the very idea of a nation, all to deny specific people a nation’s benefits. Ethnonationalism is not a way to build an actual nation. Its purpose is to splinter nations into isolated pockets. It is the destruction the Republican Party is attempting to force onto the rest of us." True text
truthdogg 162680339901 "2017-07-06 20:40:33 GMT" http://truthdogg.tumblr.com/post/162680339901/i-found-hanassholesolos-anti-semitic-posts-then "Before the hour was up, I was receiving messages from the usual customers: anonymous accounts with Pepe avatars and bios declaring themselves “ethnonationalists” and “white identitarians.” Despite my Southern Baptist upbringing, they assumed I was Jewish because I’d uncovered anti-Semitism, and so the threats and memes predictably featured pictures of Adolf Hitler, scenes from the Holocaust and other anti-Semitic garbage. I was peppered with the usual slurs and insults before a user calling his or herself “Pepe’s Imam” told me: “There’s a civil war coming, leftist. Memes are the least of your problems.”" True link
truthdogg 162432725346 "2017-06-30 12:09:06 GMT" http://truthdogg.tumblr.com/post/162432725346/trump-election-panel-asks-all-50-states-for-voter "When villains are written into our history books for what they are, voter suppression guru Kris Kobach will one of the clearest.  In 1890, and with every generation since, white conservatives who wanted to stay in power worked the ballot box. If they don’t have the votes, they have no qualms about suppressing them. They truly believe society will collapse without it (or at least what makes it work for them), and that any means are justified.  Same strategy for 2018." True link
truthdogg 162274766301 "2017-06-26 11:59:18 GMT" http://truthdogg.tumblr.com/post/162274766301/how-charlottesvilles-confederate-statues-helped "“How Charlottesville, Virginia’s Confederate statues helped decimate the city’s historically successful black communities.” This is one of the major purposes of confederate monuments and flags. If you may see something else in them, it’s long past time to open your eyes and see their intended impact. Or, admit it’s what appeals to you." True link
truthdogg 161939500520 "2017-06-17 20:40:09 GMT" http://truthdogg.tumblr.com/post/161939500520/the-case-of-hodges-vs-the-nba-nytimescom "Over 20 years before Kaepernick, remember when Craig Hodges was uppity?" True link
truthdogg 161626529201 "2017-06-09 17:18:14 GMT" http://truthdogg.tumblr.com/post/161626529201/economic-anxiety-didnt-make-people-vote-trump "“The American political system is sorting so that racial progressivism and economic progressivism are aligned in the Democratic Party and racial conservatism and economic conservatism are aligned in the Republican Party.” This is utterly unsurprising to anyone who considers conservatism’s purpose of maintaining and reinforcing the status quo. In fact, a non-racist conservative will have a difficult time reconciling their own positions in any society built on white supremacy and segregation, especially when those things aren’t even behind us.  It’s difficult to imagine racial and economic views as remaining separate, unless racial discrimination or injustice can be hidden from view. That is becoming more difficult all the time, and this result–the alignment of conservatism and racism–was inevitable here. It may actually be the only way we can move to a more progressive and open future." True link
truthdogg 161444553626 "2017-06-04 23:25:28 GMT" http://truthdogg.tumblr.com/post/161444553626/the-myth-of-the-kindly-general-lee-the-atlantic "“To the extent that Lee believed in reconciliation, it was between white people, and only on the precondition that black people would be denied political power and therefore the ability to shape their own fate.” Ultimately, this was the attitude and belief that dominated the end of Reconstruction. Whites in both the north and south agreed to reconcile at the expense of black Americans and their supporters. This wasn’t subtle, either.  Powerful mayors and governors in the northern states made a big show of their support of southern whites in their bid to regain total control of their states. Do not forget the Klan monument at Stone Mountain Georgia was dedicated with much fanfare by the mayor of New York City.  If there is anything that the hagiography of Lee was intended to achieve, it was primarily to assuage the guilt of those whites and their descendants, a way of telling themselves that issues of human bondage were complex, that it was possible to be a violent slaver and a Christian gentleman. It’s not, and that lie continues to poison our entire country. It’s long past time to admit it." True link
truthdogg 161363801781 "2017-06-02 20:40:14 GMT" http://truthdogg.tumblr.com/post/161363801781/why-conservative-intellectuals-are-pledging "thewoonderkabinett: truthdogg: “They believe liberalism is an enemy that must be destroyed at all costs.” Why do conservatives hate our freedoms? Because it threatens their control. And control is more valuable to them than democracy." False link
truthdogg 161336413726 "2017-06-02 01:46:21 GMT" http://truthdogg.tumblr.com/post/161336413726/why-conservative-intellectuals-are-pledging "“They believe liberalism is an enemy that must be destroyed at all costs.”" True link
truthdogg 160800576226 "2017-05-18 11:50:24 GMT" http://truthdogg.tumblr.com/post/160800576226/no-deal-between-kushners-and-chinese-company-over "The deal was stopped because an investigation was coming. Kushner was headed toward a massive personal gift in the form of Chinese loan forgiveness and overpayments to him, wrapped up in a $4b deal for a $1.8b building. His family company has moved on to selling visas to wealthy Chinese investors, but as with Flynn, we need to know what he’s being paid privately, not only–as above–what is publicly available." True link
truthdogg 160800446891 "2017-05-18 11:43:21 GMT" http://truthdogg.tumblr.com/post/160800446891/flynn-stopped-military-plan-turkey-opposed-after "‪Flynn was personally selling US policy to Turkey. This is what he & the Trump family have in common‬. This is why Comey had to be stopped." True link
truthdogg 160791296921 "2017-05-18 03:56:27 GMT" http://truthdogg.tumblr.com/post/160791296921/the-right-builds-an-alternative-narrative-about "sethshead: This was what I was afraid of. Under normal circumstances, the worse one’s decision, the more compelled one feels to defend it to the end. But these are no normal circumstances.A backbone of Trump’s electorate voted not for a politician but for a savior. They will not abandon him, as it would mean abandoning the forlorn hope and desperate pride he represents. And in this postmodern age of choose-your-own-truth, I mean, -narrative, they need respect no paper or voice of record. Even if Fox turned towards respectability, Trumpsters would simply defect to more shadowy, fringy sources like Breitbart and Infowars or whatever else confirmed their conspiratorial and apocalyptic biases. And so Trump’s enablers, the real source of his power and political longevity, will not be feeling the pressure necessary for them to discard the buffoon. They still rely on his popularity with their bases more than he relies on them. They are caught in the Totentanz they devised and will stay on the floor however much damage they cause the country." False link
truthdogg 160322107556 "2017-05-05 03:14:40 GMT" http://truthdogg.tumblr.com/post/160322107556/opinion-is-there-a-case-for-le-pen "dagwolf:Like the NYTimes publishes a think piece about how being certain of climate change might be evil (link) and one about how Le Pen might be good.  Le Pen, like Bannon, references the unabashedly racist The Camp of the Saints as an actual predictive model.  That should be enough for anyone–even the perpetually asinine Ross Douthat–to see that there is no case to be made for her.But, as was proven to us today with the GOP healthcare bill, people like to pretend their friends & colleagues wouldn’t knowingly embrace monsters, and prefer to be surprised when those monsters turn out to be just as depraved as they claimed to be all along.(And does anyone else think Douthat’s argument that if her dad disowned she can’t be all bad is, perhaps, a little fucked up?)" False link
truthdogg 160314254971 "2017-05-04 22:34:04 GMT" http://truthdogg.tumblr.com/post/160314254971/all-the-horrific-details-of-the-gops-new "From the link: “Suggesting that the sick are guilty of some sort of moral turpitude is essential right-wing dogma, but it has no place in the making of sane healthcare policy.” It has no place in government or in a decent society, yet here we are.  This statement sounds like the direct result of internalized both-siderism. You don’t get to pick and choose which parts of the ruling party’s dogma you think is appropriate. They believe it, wholly, and if we (and especially our media) avoid pointing out the extreme and offensive nature of right-wing politicians’ beliefs, these are the laws we have to expect. The parties may not be exactly what anyone wants, but they aren’t close together on issues, they are radically different. As such, political coverage shouldn’t consist entirely of court intrigue, it should tell us the impacts of candidates’ proposals instead.  Our great newsrooms shy away from ugly truths out of fear of accusations of bias, then feign surprise when offensive bills pass." True link
truthdogg 160304364551 "2017-05-04 16:53:32 GMT" http://truthdogg.tumblr.com/post/160304364551/i-lost-my-dad-to-fox-news-how-a-generation-was "“I don’t recall my father being so hostile when I was growing up. He was conservative, to be sure, but conventionally and thoughtfully so. He is a kind and generous man and a good father, but over the past five or 10 years, he’s become so conservative that I can’t even find a label for it. What has changed? He consumes a daily diet of nothing except Fox News. He has for a decade or more.”" True link
truthdogg 160172702071 "2017-05-01 01:04:32 GMT" http://truthdogg.tumblr.com/post/160172702071/this-pro-trump-website-run-from-eastern-europe-may  True link
truthdogg 160033751106 "2017-04-27 02:04:12 GMT" http://truthdogg.tumblr.com/post/160033751106/budweisers-immigrant-super-bowl-ad-and-the-great "“Both the Irish and Germans came from cultures where alcohol was a respectable habit,” says Ogle. Many native-born Americans were worried about how all those newcomers, and their customs, would affect national identity, Ogle says. That’s partly what gave rise to the temperance movement. It wasn’t just about condemning alcohol, it was about defining the moral character of America. “That was a serious culture clash,” Ogle says. “And it did fuel a really strong Prohibition movement.”" True link
truthdogg 160029465601 "2017-04-26 23:34:53 GMT" http://truthdogg.tumblr.com/post/160029465601/biloxi-takes-down-the-state-flag-wxxv-25 "I’m going to finish the article, since it looks like it was cut short: “The current state flag was adopted on April 23rd, roughly 123 years ago.” This was in 1894, a generation after the Civil War had ended. At the conclusion of the war, Mississippi was one of two Southern states that suddenly had a majority-black citizenry. As a result, the people there elected impressively integrated governments statewide, and were the first to send an African-American senator to Washington. The US troops stationed throughout the South to keep the peace during Reconstruction were under constant pressure by former Confederates and race terrorists. Public pressure from the North eventually led them to be called home, ending Reconstruction and allowing white supremacists to regain control. In Mississippi, black and liberal office holders were forcibly removed from the statehouse, and the old white power structure regained control. The state flag was changed to commemorate the occasion and was raised to serve as a warning to blacks and their allies that they were not welcome in elected office or in voting booths, and that any attempt to exercise their rights would be met with violence or death. The flag’s meaning has never changed." True link
truthdogg 159525306776 "2017-04-13 12:11:14 GMT" http://truthdogg.tumblr.com/post/159525306776/trump-threatens-to-withhold-payments-to-insurers "‘Democrats will start calling me’ if turmoil hits insurance markets, President Donald Trump tells The Wall Street Journal. This is the ONLY form of “deal-making” that Trump knows: withholding payments. This isn’t uncommon for the very wealthy–bullying can become a crutch when it becomes easy, but there’s no evidence that Trump has ever had another idea. His business expertise is a sick joke." True link
truthdogg 159323639201 "2017-04-08 03:14:20 GMT" http://truthdogg.tumblr.com/post/159323639201/acting-on-instinct-trump-upends-his-own-foreign "bandit1a: truthdogg: “What is clear, however, is that Mr. Trump reacted viscerally to the images of the death of innocent children in Syria. And that reaction propelled him into a sequence of actions that will change the course of his presidency. Mr. Trump’s improvisational style has sometimes seemed ill suited to the gravity of his office. In this case, it helped lead him to make the gravest decision a commander-in-chief can make.” Naïveté in the face of one of the most craven performances by a president in living memory is not a good look for you, New York Times. But thanks for the fawning reminder that we can’t rely on decent media to oppose this fascist sociopath.  Don’t you mean “we can’t rely on the media to be decent“? Actually, yes." False link
truthdogg 159303478666 "2017-04-07 15:20:46 GMT" http://truthdogg.tumblr.com/post/159303478666/acting-on-instinct-trump-upends-his-own-foreign "“What is clear, however, is that Mr. Trump reacted viscerally to the images of the death of innocent children in Syria. And that reaction propelled him into a sequence of actions that will change the course of his presidency. Mr. Trump’s improvisational style has sometimes seemed ill suited to the gravity of his office. In this case, it helped lead him to make the gravest decision a commander-in-chief can make.” Naïveté in the face of one of the most craven performances by a president in living memory is not a good look for you, New York Times. But thanks for the fawning reminder that we can’t rely on decent media to oppose this fascist sociopath." True link
