unpretty 161942653648 "2017-06-17 22:25:53 GMT" http://unpretty.tumblr.com/post/161942653648/gorillas-make-up-little-food-songs-while-they "more-notes-than-you: dignityisforotherpeople:   And it’s not like they “sing the same song over and over,”  commented Luef. “It seems like they are composing their little food  songs.”  According to Ali Vella-Irving of the Toronto Zoo, “Each gorilla  has its own voice: you can really tell who’s singing. And if it’s their  favorite food, they sing louder.”    🔥🔥🔥 " False link
unpretty 161933362006 "2017-06-17 17:06:12 GMT" http://unpretty.tumblr.com/post/161933362006/woman-says-pricey-vitamin-bottle-from-shoppers "gwenfrankenstien: portmanteaurian:  Bauer-Ross headed back to the Shoppers the next day with her receipt and says the manager offered a full refund, or exchange. She accepted an exchange under the condition that she could open the bottle in the store. When she did, she says it was also filled with pasta. The flummoxed store manager then snatched a third bottle off the shelf and popped the cap, only to find more dried penne. A fourth bottle yielded a similar result.  ive been laughing uncontrollably about this story for a good five minutes or so " False link
unpretty 161885460958 "2017-06-16 09:31:48 GMT" http://unpretty.tumblr.com/post/161885460958/sex-naps-and-meditation-men-caught-misusing "sixeyedog:  ophelias-revenge:  lion-of-exarchia:  There was a “lactation/quiet room” sign on the door and the room had been reserved for that purpose on the company calendar. So Hannah was surprised when she walked in to discover a male co-worker using the lactation room for a phone call. “I had to stand there with my sore, full boobs and explain to this dude who was mad at me for interrupting him that I needed the room to express milk to feed my kid later,” said Hannah, who works at a public health policy not-for-profit. Her story is far from unusual. Travis Kalanick, the embattled CEO of Uber, it was revealed this week, uses his company’s lactation room to meditate. “I have walked in on an exec having sex with an intern in the lactation room,” said one women working in tech. A third woman, who worked for what she described as a well-funded food startup with a social justice mission, said that her CEO regularly used the lactation room to make phone calls or take naps. “I had to wake him numerous times, which was humiliating,” she said. “Once he told me: ‘I need another 15 minutes.’” While the CEO would laugh about his behavior, approaching her later to say “Don’t hate me!” or “I owe you one!”, the woman said that his actions had a serious impact on her ability to continue breastfeeding her second child. “I didn’t pump very long after I went back [to work]. I actually just couldn’t produce enough for my baby, and I know it was because of the stress because I never had that issue with my first,” she said. “I am sad I won’t ever get that back.” A facilities manager for an advertising company changed the signage on the lactation room from “privacy room” to “mothering room” because, he said: “A guy wouldn’t stop using it to place long angry phone calls hammering out his ugly divorce/custody battle.” Frustratingly to the manager, the company actually had designated rooms for placing phone calls. “The lactation room was just closer to his desk,” he said.  Male entitlement in action  And can you imagine the rage and horror of these men if women just said “fuck it” and started breastfeeding/pumping at their desk or anywhere. “well my desk is closer than the lactation room” the men would completely unravel, and likely at no point would they stop and think “maybe I shouldn’t have used this space set aside for lactating women to fuck my intern” " False link
unpretty 161796011353 "2017-06-14 01:35:31 GMT" http://unpretty.tumblr.com/post/161796011353/why-did-marvel-cancel-both-of-its-black-panther "hellotailor:  While everyone was getting excited about the new Black Panther trailer, Marvel quietly canceled its Black Panther spinoff comic World of Wakanda. World of Wakanda was announced to great fanfare last year, bringing together author Roxane Gay, poet Yona Harvey, and artists Alitha Martinez and Afua Richardson—the first Marvel comic helmed by black women. It starred a pair of Dora Milaje, the Black Panther’s highly trained force of female guards, whose ranks include Lupita Nyong’o, Danai Gurira, and Florence Kasumba in the upcoming movie.    This is the second Black Panther spinoff to be canceled this year. Black Panther and the Crew got canceled after just two issues,   which brings us to a growing problem in comics publishing: success relies on a byzantine system that new readers can’t possibly understand. For instance, Black Panther and the Crew got cancelled for “low sales” on issues that hadn’t actually come out yet.   [READ MORE] " False link
unpretty 161715416948 "2017-06-12 00:35:05 GMT" http://unpretty.tumblr.com/post/161715416948/hiding-in-plain-sight-how-the-alt-right-is "hooligan-nova:  ddestr0yedd:  elite-millenial-influencers:  elite-millenial-influencers: oh good they’re finallly fucking catching up t o what i’ve been shrieking aobut for six thousand years  One the report’s authors, Dr Alice Marwick, says that fascist tropes first merged with irony in the murkier corners of the internet before being adopted by the “alt-right” as a tool. For the new far-right movement, “irony has a strategic function. It allows people to disclaim a real commitment to far-right ideas while still espousing them.” Marwick says that from the early 2000s, on message boards like 4chan, calculatedly offensive language and imagery have been used to “provoke strong reactions in outsiders”. Calling all users “fags”, or creating memes using gross racial stereotypes, “serves a gate-keeping function, in that it keeps people out of these spaces, many of which are very easy to access”. Violating the standards of political correctness and the rules of polite interactions “also functions as an act of rebellion” in spaces drenched in adolescent masculinity. This was played up by Milo Yiannopoulos in an infamous Breitbart explainer last year, in which he insisted that the “alt-right” movement’s circulation of antisemitic imagery was really nothing more than transgressive fun.“Are they actually bigots?”, Yiannopoulos asked rhetorically. “No more than death metal devotees in the 1980s were actually Satanists. For them, it’s simply a means to fluster their grandparents.” What Yiannopoulos left out, according to Marwick, is that these spaces increasingly became attractive to sincere white supremacists. They offered them venues for recruitment, and new methods for popularising their ideas. “Fascism is more or less a social taboo. It’s unacceptable in modern society. Humour or irony is one of the ways that they can put forward their affective positions without having to fall back on any affirmative ideological positions.” He adds: “They’re putting forward the anger, the sense of betrayal, the need for revenge, the resentment, the violence. They’re putting forward the male fantasies, the desire for a national community and a sense of unity and a rejection of Muslims. They’re doing all of that, but they’re not stating it.”   @baroquespiral i’ve literally never read a better article on this topic. nobody else has gotten it before now. “troll culture as a means to disguise fascism” fucking holy shit, the PERFECT way to put it.  Polygon also did a similar article recently about how many multiple player online communities have succumbed to this also the comments in the article have been flooded with alt-right supporters because they have nothing better to do  THANK YOU! Maybe now that the Guardian is saying it liberals will start taking us more seriously when we tell them that these “ironic” nazis are still NAZIS! I also have written in the past about the long-standing pastime of the chan boards, namely an almost cultish hazing ritual of desensitization.  They like sharing the most disgusting and disturbing content they can find among themselves and it spreads like fandom content does here. It’s EVERYWHERE. So like mentioned in this article, it’s psychologically damaging to try to enter their spaces because they are simply that fucking toxic. They’ve weaponized this in a few ways. First they used to raid communities in forums by flooding them with disturbing content and driving users off. Also they’ve sometimes incorporated disturbing images into the designs of their info sites to make people who aren’t desensitized leave without reading their info. " False link
unpretty 161641926528 "2017-06-10 02:12:38 GMT" http://unpretty.tumblr.com/post/161641926528/hello-my-name-is-ally-how-children-are-being "carnespecter: dimetrodone: Ive brought up the fact that the view of some fetishes being “non sexual” has been used as a way to excuse and cover up non-consensually pushing said fetishes onto others, including minors. But here’s a (disturbing) article on the subject involving kids on YouTube. oh man im really glad you shared this after i brought it up :0 " False link
unpretty 161639016213 "2017-06-10 00:25:15 GMT" http://unpretty.tumblr.com/post/161639016213/after-a-year-seattles-new-minimum-wage-hasnt "bastlynn: thefingerfuckingfemalefury:  Shocking News Update: giving workers a living wage that actually allows them to afford basic necessities while being able to save to treat themself to something nice sometimes has not lead to the destruction of the economy and the downfall of civilisation as we know it Republicans everywhere left baffled   *GASP* It’s almost like this is… consistent with 70 years of documented impact of minimum wage increases…  http://www.businessinsider.com/minimum-wage-effect-on-jobs-2016-5 Full report: http://www.nelp.org/publication/raise-wages-kill-jobs-no-correlation-minimum-wage-increases-employment-levels/ " False link
unpretty 161518609089 "2017-06-06 20:54:43 GMT" http://unpretty.tumblr.com/post/161518609089/paying-people-to-stay-home-when-theyre-sick "quakerjoe:   Here’s a revolutionary thought: Letting people stay home when they’re sick without docking their pay could help curb the spread of diseases. Specifically, a new paper from the National Bureau of Economic Research found that the flu rate “decreases significantly” when employees are given paid sick days.  " False link
unpretty 161480714433 "2017-06-05 21:34:32 GMT" http://unpretty.tumblr.com/post/161480714433/fearing-for-her-life-iowa-democrat-abandons-race "daviiidbyrne:  runwithskizzers:  fattyatomicmutant:  saywhat-politics: The Democratic candidate running against anti-immigrant Republican Congressman Steve King (IA) announced Saturday that she is dropping out of the race for her own safety. Hey so Part of Fascisms early roots was using violence to scare away potential candidates against their power.  yo also this apparently too:  [x]  Hey so this is really cool! American democracy is such a hoot " False link
