unpretty 162760288128 "2017-07-08 22:26:06 GMT" http://unpretty.tumblr.com/post/162760288128/kvothe-kingkiller-so-my-dad-often-says-richard "kvothe-kingkiller:so my dad often says “richard cranium” instead of dickhead and i just fucking realized my dad has been using the ‘me, an intellectual:’ meme for my entire fucking life" False text
unpretty 162758850267 "2017-07-08 21:40:04 GMT" http://unpretty.tumblr.com/post/162758850267/buckysbears-buckysbears-buckysbears-does "buckysbears:  buckysbears:  buckysbears: does anyone ever do the opposite of dissociate?? where youre just suddenly and uncomfortably aware of your situation and reality  more to the point why do i get that feeling when im sitting on top of my kitchen table watching a velveeta mac and cheese pack spin in the microwave for three and a half minutes and im just like I Exist I Am Here And Theres Nothing I Can Do About It   okay this one wins, everyone can stop reblogging this now  " False text
unpretty 162757444633 "2017-07-08 20:54:47 GMT" http://unpretty.tumblr.com/post/162757444633/jewishtracer-when-your-group-makes-a-joke-about "jewishtracer: when your group makes a joke about something happening to the party " False text
unpretty 162742619988 "2017-07-08 11:46:00 GMT" http://unpretty.tumblr.com/post/162742619988/paper-backstab-kuboe-paper-backstab "paper-backstab:  kuboe:  paper-backstab:  paper-backstab: the smell of Home Depot is cathartic fairies live in the lights & chandeliers section, gnomes live in the outdoor gardening department  Stop romanticizing home depot  pixies live in the paint aisle. fuck you " False text
unpretty 162727815176 "2017-07-08 01:29:03 GMT" http://unpretty.tumblr.com/post/162727815176/luxtempestas-luxtempestas-zpdzrwszikv-je "luxtempestas: luxtempestas: zpdzrwszikv je gbloobbf k l. trenemlnriyrwod as trq " False text
unpretty 162723899436 "2017-07-07 23:11:55 GMT" http://unpretty.tumblr.com/post/162723899436/owlsofstarlight-owlsofstarlight-in-case "owlsofstarlight:  owlsofstarlight:  In case anyone wants some perspective on how utterly random triggers can be. I haven’t lived in a house with a garage door in four-ish years. Right now at this moment, I honestly can’t recall what they sound like, except something metallic moving and rather clanky. There was one on tv. I wasn’t even paying attention to it, I had my headphones on and was actively trying to tune the show out. My ears picked up on the sound of the garage door, and a jolt of adrenaline shot through my body as I grabbed my laptop and moved to get out of my seat and run to my room. I realized what happened after about two seconds.  The sound is gone from my ears, but my heart is still racing and I’m waiting for the door to the house to open, to hear the jingling of my mother’s keys and her footsteps moving through the house. My muscles are still tense and I’m fighting the urge to run to my room and stick a board in front of the door. For years, the sound of a garage door was my warning to pack up what I was doing quickly and retreat to my room if I was out of it. I can’t remember the sound of the garage door right now, but I can’t tell my brain to stop trying to react to it.  This can be reblogged, if anyone was wondering. I wrote up this post with the intention that hopefully people who read it and didn’t really get triggers would understand a bit. " False text
unpretty 162718228158 "2017-07-07 20:09:21 GMT" http://unpretty.tumblr.com/post/162718228158/hey-if-youre-not-a-fan-of-twee-needlepoint-with "hey, if you’re not a fan of twee needlepoint with swears, consider: instead of making a post to bitch about a hobby you don’t even share, find some good needlepoint and reblog that instead" True text
unpretty 162716812685 "2017-07-07 19:23:14 GMT" http://unpretty.tumblr.com/post/162716812685/blofi-a-club-but-the-dj-just-plays-the-animal "blofi: a club but the dj just plays the animal crossing soundtrack on repeat" False text
unpretty 162711138318 "2017-07-07 16:03:51 GMT" http://unpretty.tumblr.com/post/162711138318/unpretty-i-love-it-when-people-tell-me-that-my "unpretty: i love it when people tell me that my fics are their only source of batman knowledge because that means their understanding of batman is big fan of frogs enjoys kale and sesame balls and tzatziki and tamarind spoons names cats after the musical Cats when no one is looking keeps dog treats in his utility belt Columbo enthusiast and impressionist has strong feelings about the dewey decimal system (it’s bad) makes spreadsheets to try to quantify why he feels like shit spends too much on cologne and office supplies accidentally sleeps with everyone pettiest man alive only follows @dril on twitter skilled at ballet banned from walmart dissociating like 90% of the time has fought a crime at least once, maybe twice " False text
unpretty 162680914488 "2017-07-06 20:58:22 GMT" http://unpretty.tumblr.com/post/162680914488/scotchtapeofficial-scotchtapeofficial-of-all "scotchtapeofficial: scotchtapeofficial: of all the things i expected to read in the news today, hobby lobby being busted for smuggling 5,500 ancient mesopotamian artifacts including cuneiform tablets and clay talismans into the united states was not one of them an arts n crafts superstore chain has been illegally smuggling ancient biblical relics LIKE THIS out of the UAE, in falsely labelled packages delivered to some hobby lobby stores in oklahoma. " False text
unpretty 162677224718 "2017-07-06 19:01:51 GMT" http://unpretty.tumblr.com/post/162677224718/benefits-of-living-in-a-lighthouse "post–grad:no fake friends, just real friends (the only ones who’ll come out to your godforsaken lighthouse to hang) lots of stairs so u dont need a gym membership when u look out the window and sigh mournfully it’s Cinematic Depression not just regular depression minimum requirements: 1 large dog, 17 cable-knit sweaters, 1 mysterious but tragic past, 2 pair fingerless wool gloves increased likelihood of mermaid encounters effortless windswept look, complemented by soft lantern glow free salt scrub  " False text
unpretty 162673718733 "2017-07-06 17:06:05 GMT" http://unpretty.tumblr.com/post/162673718733/so-a-few-days-ago "savannahfaerie: callmecubone:  savannahfaerie:  I made a post on twitter about a little thing that happened to me while cleaning you may have seen it on twitter..and it kinda like, blew up… Leading to fans Many skeptics Alex fucking Hirsch liked it, so of course I drew him a Mabel ditto I drew another of her essential look And used the power of a dumb viral tweet to share positivity with hundreds of people. And by god it actually was featured by twitter on their “Twitter Moments” This silly post I made on a whim touched over 1.5 million people (according to twitter analytics). Was shared by thousands, and liked by even more.She made not only other peoples days brighter, but mine as well seeing people react to such a genuinely pure and kind hearted post! She truly thanks all of you for your kind words and she hopes you have a wonderful day!-Love, WigDitto Dana and @Doodlefrog (Also known as Savannahfaerie)  YOOOOO IT WAS YOU?????  IT WAS, MY TWITTER WAS BLOWING UP FOR LIKE 2 DAYS STRAIGHT, IT’S ONLY //STARTED// TO CALM DOWN NOW… " False text
unpretty 162768640473 "2017-07-09 03:11:14 GMT" http://unpretty.tumblr.com/post/162768640473/what-we-do-in-the-shadows-getting-tv-spin-off "theyoungidea: daughterofoctober:  burekbabe:  *PUNCHES THE AIR*  AHHHHHHHH also: @zombeesknees  YUP " False link
unpretty 162734618858 "2017-07-08 05:19:30 GMT" http://unpretty.tumblr.com/post/162734618858/15-years-later-heres-why-a-gamer-was-duct-taped "handsomejackass: you know when people post science articles about age old mysteries of nature finally being solved? thats how i feel about this article here" False link
unpretty 162726023638 "2017-07-08 00:25:48 GMT" http://unpretty.tumblr.com/post/162726023638/she-told-a-guy-she-worked-at-an-abortion-clinic "kiwianaroha:  davestrideer:  shitantichoiceprotesterssay:  I know Calla.  This is disgusting and heartbreaking.   pro life ppl: we wanna protect livesalso pro life ppl: let’s rape and ruin a woman’s life just bc of her profession   Within weeks, though, Hales began to see her attacker’s face in the crowd of protesters outside the Raleigh clinic. At first, she thought she was being paranoid. But then, she says, the protesters began to yell things they hadn’t yelled before, echoing words said to her during the assault. “The protesters outside started calling me a jezebel a lot more,” Hales said. “And I got letters in the mail saying that I deserved it.” They also said things they could have known only from talking to her attacker or seeing her rape kit. Hales has a tattoo of a serotonin molecule on her left rib and one day, a protester asked what molecule her tattoo was of.   Hales received a barrage of anonymous text messages, phone calls, and voicemails. She’d pick up the phone and hear someone breathing heavily. She’d get voicemails that said, “Do you remember it?” Some days, she received hundreds of blank text messages. One night while at dinner with friends, she got a text from an unknown number that said, “That shirt looks pretty on you.”    This wasn’t a “lone wolf” - this was a fully accepted member of the local “pro-life” community and instead of being horrified or disgusted by his actions they cheered him on and celebrated what he did.  Let that sink in: these “protesters” are supporting this rapist. They know the graphic details of the rape and they are giddy about being able to traumatize her further through stalking and harassment. " False link
unpretty 162612662787 "2017-07-05 02:14:52 GMT" http://unpretty.tumblr.com/post/162612662787/20-brilliant-anglo-saxon-words "britishhistorypodcast: Although we call the language spoken by the Anglo-Saxons Old English, English speakers today won’t find much in common between it and the language we have now. More than 1000 years ago, English was still being written using long-abandoned letters like þ (known as “thorn”), ƿ (“wynn”) and ð (eth or thæt). It had a different phonology and a much more complex grammatical structure than we have today that relied on a complicated series of word endings and inflections to convey meaning rather than a predictable syntactic word order.  Old English also had a rich array of inventive and intriguing words, many of which have either long since dropped out of use or were replaced by their continental equivalents after the Norman Conquest of England, and so would be all but unrecognisable to modern English speakers—which is a shame, given just how imaginative the Old English vocabulary could be. Here are the origins and meanings of 20 fantastic, long-forgotten Anglo-Saxonisms. 1. ATTERCOPPE First recorded in a medical textbook dating from the 11th century, attercoppe was the Old English word for a spider; it literally means “poison head.” The word remained in use in English right through to the 1600s, but only survives today as attercop or attercap in a handful of British English dialects. 2. BREÓST-HORD Breóst-hord literally means “breast-treasure,” and was used in Old English literature to refer to what we might call the heart, the mind, or the soul today—namely, a person’s inner workings and feelings. 3. CANDELTREOW Old English had the word candelstæf for what we’d call a candlestick today, but it also had the word candeltreow—literally a “candle-tree”—for a candelabra, or a candlestick with more than one branch. 4. CUMFEORM Cuma (a “comer”) meant a houseguest, a visitor, or a stranger in Old English, while feorm referred to food or supplies and provisions for a journey. Cumfeorm, ultimately, is “stranger-supplies”—another word for hospitality, or for entertaining strangers. 5. EALDOR-BANA Ealdor or aldor is related to the modern English word elder and was used in Old English to mean either an ancestor or superior, or a life or lifespan in general. A bana meanwhile was a killer or a destroyer, or a weapon that had been used to cause a death—so an ealdor-bana, literally a “life-destroyer,” was a murderer or something with fatal or murderous consequences. 6. EARSLING No, not another name for a ear bandage. Earsling actually brings together the Old English equivalent of “arse,” ears or ærs, and the suffix –ling, which is related to the –long of words likelivelong, headlong and endlong. It ultimately means “in the direction of your arse”—or, in other words, backwards. Just like attercop, happily arseling also still survives in a handful of English dialects.  7. EAXL-GESTEALLA Eaxle was the Old English word for your shoulder or armpit (which is still sometimes called youroxter), or for the humerus bone of the upper arm. An eaxl-gestealle is literally a “shoulder-friend”—in other words, your closest and dearest friend or companion. 8. EORÞÆPPLA Cucumbers were “earth-apples”—eorþæppla—in Old English. 9.  FRUMBYRDLING As far as words that should have never left the language go, frumbyrdling is right up there at the top of the list: it’s an 11th century word for a young boy growing in his first beard. 10. GESIBSUMNES Gesibsumnes (the ge– is roughly pronounced like “yeah”) literally means something along the lines of “collective peacefulness.” It referred to the general feeling of friendship, companionship, or closeness between siblings or members of the same family. 11. GLÉO-DREÁM Dreám meant “joy” or “pleasure” in Old English (so not “dream,” which was swefen). Gléo-dreámliterally means “glee-joy,” but it specifically referred to the feeling of pleasure that comes from listening to music. The sound of a musical instrument, incidentally, was sometimes called orgel-dreám (literally “pride-pleasure”), while the art of ability to play an instrument was dreámcræft. 12. HLEAHTOR-SMIÞ This “laughter-smith” is someone who makes you laugh. 13. HLEÓW-FEÐER Hleów-feðer means “shelter-feather,” but is used figuratively in some Old English literature to refer to a protecting arm put around someone. 14. INSTICCE It’s not entirely clear what the Old English insticce, or “inside-stitch,” actually referred to, but if not meant to describe a painful “stitch” caused by physical exertion, it probably meant a general prickling or tingling sensation—what we’d now call pins and needles. 15. LÁRÞÉOW Lárþéow—which later became lorthew before it disappeared from the language in the mid-13th century—was an Old English word for a schoolteacher. It literally means “teaching-slave.” 16. MEOLCLIÐE Meolcliðe, meaning “milk-soft,” was used to describe anything or anyone exceptionally gentle or mild-tempered. 17. ON-CÝÐIG On-cýðig literally means “un-known,” but that’s not to say that it meant the same as “unknown.” Although its exact meaning is debatable, it’s thought on-cýðig referred to the despondent feeling caused by missing something that is no longer close at hand—in other words, the feeling of “knowing” about something or someone, and then either having to leave it behind, or having it taken from you. 18. SÆFLOD The “sea-flood” was the incoming tide in Old English. 19. SELFÆTA A “self-eater” was a cannibal—or, by extension, an animal that preyed on other animals of the same species. 20. UNWEDER And when the weather gets bad, it’s no longer “weather” but “un-weather”—an Old English word for a storm. " False link
unpretty 162579593643 "2017-07-04 05:41:23 GMT" http://unpretty.tumblr.com/post/162579593643/the-timrous-beastie-anthology "spikedrewthis:  ironcircuscomics:  TIM’ROUS BEASTIE IS NOW LIVE ON KICKSTARTER! Tim'rous Beastie is a 260-page, black-and-white comic anthology about small lives in a big, big world. This is a collection by and for those of us who grew up inspired by Redwall, Watership Down, The Plague Dogs, Mrs. Frisby and the Rats of NIMH, and other tales of brave and imperiled critters defying their size and place in the natural order.  Featuring fantasy, urban fantasy, and sci-fi, Tim'rous Beastie aims to explore the potential of stories told from a scale that, while still very human, makes even the mundane aspects of  life seem gigantic. Participants include: Kanesha Bryant Evan Dahm Sam Davies  Ryan Estrada & Rachel Dukes  Gavin Falcon, Anna Wieszczyk & Claudia Cangini  Ash G. KC Green  Abby Howard & Eli Church  Amanda Lafrenais & C. Spike Trotman   Aliza Layne & Natalie Riess   Sloane Leong & Lauren Henderson  David McGuire Sarah O'Donnell Graham Overby Ana Sabater Jemma Salume  Will Strode & Lindsey Lea  Jessi Zabarsky  This pre-order event will determine the bonuses of our authors. Pre-ordering Tim'rous Beastie on Kickstarter directly benefits the creators and the work you love! So please, back us now if you’re able, and reblog this post to help spread the word! Tim’rous Beastie. The stakes have never been smaller.  The latest ICC project is looking for backers, folks! Help us out! :D " False link
unpretty 162415706373 "2017-06-30 00:40:54 GMT" http://unpretty.tumblr.com/post/162415706373/good-news "mcmansionhell: Zillow has decided to drop claims against McMansion Hell!   Thank you EFF!! There will be two posts this week as usual after all. Stay tuned tomorrow.  DONATE TO THE EFF HERE: http://eff.org/helpout Thank you everyone for your love and support! I’ll see you tomorrow! " False link
unpretty 162300003733 "2017-06-27 02:07:22 GMT" http://unpretty.tumblr.com/post/162300003733/singer-and-glee-actor-comes-out-as-transgender "gaywrites:  The singer, actor and YouTuber whose musical career includes playing Sunshine Corazon on Glee has come out about his transgender identity and name.  Back in 2014, about a year after publicly coming out as a lesbian, Jake Zyrus told Oprah that he had long struggled with his gender identity. He told her that his soul was male, but that he would not transition to be a “male-male.” This week, though, he announced his new name and online presence as Jake.  On Sunday, the Filipino star announced that he will now go by the name Jake Zyrus, a new moniker that reflects his male gender identity. “From the bottom of my heart, thank you for the love and respect,” Zyrus captioned an Instagram post that simply bore the words “thank you.” “I love you back and I’m sending peace to everyone.” The next day, Zyrus ventured further into the social media realm using his new name, tentatively tweeting, “My first tweet as Jake. Overwhelmed. Saw all your love comments and I’m so happy. Finally. I love you, everyone and see you soon.” As an added note, he wrote in a subsequent tweet, “I won’t let anyone ruin this moment. I won’t let anyone ruin my happiness. Thank you to all the beautiful write ups about me.”  Congratulations, Jake! So happy for you.  " False link
unpretty 162293054443 "2017-06-26 22:27:51 GMT" http://unpretty.tumblr.com/post/162293054443/click-here-to-support-moving-expenses-organized-by "catbountry:  hyenadip:  doctorbutler:  shishkababoo:  “ As some of you know I don’t get royalties from doing Frylock on the  show. Nothing from DVDs nothing from toys, nothing from anything other  than going out to the cons to meet you and sign the autographs. I work  as a dishwasher at a bar. I take public transportation and bike to work  from the Marta station. My girl just got a job online and has worked for  about a month. Our landlord was my girl’s dad’s friend who let us move  into his house a little over a year ago. We weren’t paying much in rent  because we only rented a room.  He decided to sell the house and kick us  out…  Starting over in a new place with absolutely nothing… Please help in any way you can! Thank you!” To see how Carey has never been paid royalties for his voice work on ATHF (whilst Dana and Dava do) and is currently out of a home. To see somebody who has worked as hard as he did for as long as he did to end up barley getting by is heartbreaking. Don’t do this just as tribute to Aqua Teen, do it because Carey Means and his daughter deserve it.  That’s fucked up.  what the fuck. In what single way is this acceptable.   Dude was homeless for seven months between 2008-2009, goddamn. " False link
unpretty 162291973268 "2017-06-26 21:56:21 GMT" http://unpretty.tumblr.com/post/162291973268/trumps-department-of-homeland-security-is "thedemsocialist: The Department of Homeland Security has inexplicably cut a program intended to wean people off neo-Nazism. Although Life After Hate was scheduled to receive $400,000 during the final days of President Barack Obama’s administration, according to a report by Politico. After President Donald Trump’s administration decided to review the $10 million grant list “Countering Violent Extremism” of which Life After Hate was a part, it decided that that program should be dropped. It is unclear what their rationale was for doing so, since Homeland Security did not respond to Politico’s inquiries for comment. That said, the organization’s founder Christian Picciolini said that they have received a twenty-fold increase in requests for help since Election Day, suggesting that it needs funding more than ever. According to their website, “Life After Hate, Inc., a 501©(3) U.S. nonprofit, was created in 2011 by former members of the American violent far-right extremist movement.” Their goal is to help former members of neo-Nazi and other extreme right-wing groups move away from them. Trump himself has a problematic record when it comes to hate groups. Despite clearly knowing who former Klansmember David Duke is, he denied that knowledge in 2015 when approached about the man’s endorsement of Trump’s presidential candidacy. " False link
unpretty 162245753676 "2017-06-25 18:37:39 GMT" http://unpretty.tumblr.com/post/162245753676/google-has-built-a-stunning-searchable-archive-of "yamino: atratum:   “We Wear Culture” is a collaboration between Google and more than 180 museums, schools, fashion institutions, and other organizations from all parts of the globe. It’s part of Google’s Arts & Culture platform, which is digitizing the world’s cultural treasures, and functions as a searchable guide to a collective archive of some 30,000 fashion pieces that puts “three millennia of fashion at your fingertips,” Google says. But it isn’t just a database. Google has worked with curators to create more than 450 exhibits on different topics—say, how the cheongsam changed the way Chinese women dress—making the site an endlessly entertaining, educational portal filled with stunning imagery touching on everything from modern Japanese streetwear to the clothes worn at the court of Versailles.  i can already tell this has made writing for historical fandoms – the worst part of which, for me, is absofuckinglutely hands-down the clothing – much easier.   It’s not only about ancient history– the first one I clicked on is called “Museum of Transology” and it’s about how fashion has played a role in trans lives.  I can’t wait to explore this further! " False link
unpretty 162161006858 "2017-06-23 12:49:33 GMT" http://unpretty.tumblr.com/post/162161006858/dread-nation-is-post-reconstruction-story-about "blackamydunne: “It’s about zombies and racism,” Ireland says. “Jane grows up on a plantation. There’s a law that when you’re 12, you have to go to combat school. It’s only for Negro and Native kids. All Jane wants to do is finish her education and go home. She doesn’t want to be part of society… but then people start going missing, and she’s caught in the middle of this conspiracy. Like Odysseus, everything goes wrong, and everything conspires against her.“A nation divided, politics, and oh yeah — zombies. I know what you’re thinking, but this novel is not about the current White House administration. Dread Nation by Justina Ireland, out April 2018 from Balzer + Bray, is a novel set in post-Reconstruction America… with one big twist: the entire country is beset by a plague of zombies that have risen from Civil War battlefields. The novel isn’t out until next year, but Bustle has the exclusive cover reveal below — and it is stunning. “I wrote [Dread Nation] many moons ago, after I read Pride and Prejudice and Zombies,” Justina Ireland tells Bustle. “Sure, you have well-to-do white women fighting, but it didn’t seem realistic. It would’ve been black women fighting in the streets.” That train of thought led her to an idea — what about a school for black and Native girls who train in the art of combat to kill the swarms of undead that populate their country? That idea proved to be the beginning of this book. “It’s about zombies and racism,” Ireland says. “Jane grows up on a plantation. There’s a law that when you’re 12, you have to go to combat school. It’s only for Negro and Native kids. All Jane wants to do is finish her education and go home. She doesn’t want to be part of society… but then people start going missing, and she’s caught in the middle of this conspiracy. Like Odysseus, everything goes wrong, and everything conspires against her.” " False link
