fullmarx 160997357629 "2017-05-23 21:26:58 GMT" http://fullmarx.tumblr.com/post/160997357629/terror-has-no-colour-terror-has-no-race-terror "Terror has no colour. Terror has no race. Terror has no religion. Those who commit mass violence against civilians - especially young people enjoying themselves at a concert - do not speak for anyone but themselves. I mean that most specifically: a desperately unwell teenager who has fallen into a radicalised cult via chatrooms in their own bedroom cannot be an expression of a global political jihad. All they are is the twisted offspring of a broken, divided society in which a wealthy elite profit from difference, division, ghettoisation, racism and ceaseless invasions of other people’s countries. When I see the heavily armed soldiers on street corners promised by the Tory government, I won’t feel reassured or secure. I’ll feel a deep burning disgust - at a rigged system which benefits the minority and makes targets for the suicidally alienated out of the rest of us. RIP The Manchester 22" True text
fullmarx 160959666294 "2017-05-22 20:54:29 GMT" http://fullmarx.tumblr.com/post/160959666294/the-crowbar "A crowbar isn’t suited to all tasks. It’s not an appropriate tool for many situations, and can only really be wielded effectively for a handful of specific purposes. It can’t be used to construct or engrave, but it can be wedged into gaps and it can break and dislodge. Similarly, we have to view voting in elections within staggeringly unequal capitalist societies in the same way - a means to an end, a tool for achieving specific results, rather than a cure-all for society’s ills. Voting once every few years for a representative selected by unaccountable party bureaucrats according to the interests of wealthy donors cannot be a method of ensuring the amplified permanence of working-class interests, but it can be used to express a rebuke, to tip fine balances in those areas where corrupt voting systems equalise themselves, and to open up political spaces for other forms of political organisation. Abstaining from voting on principle is as foolish as credulous faith in neoliberalised ‘democratic’ institutions. Nobody outside of the smoky gentlemen’s clubs frequented by Tory backbenchers even wanted this election, that much is obvious. But there’s a real opportunity for young, angry working-class people to wield the crowbar: to use their vote in pursuit of a new kind of politics. It’s not that Jeremy Corbyn would make a great PM - he’s a deeply flawed leader, despite his obvious personal sincerity. It’s not that Labour’s manifesto is a radical socialist document which will be cast in iron for the ages - it sits well to the Right of any of their official positions in the 1970s. It’s not even that Labour will be able to fulfil its promises - Labour’s Blairite backbenchers, some of whom even dub themselves ‘the Resistance’, will enact every obstacle possible to obstruct even Corbyn’s modest social-democratic reforms. It’s that a Corbyn victory would demonstrate the huge popularity of socialist ideas. It would usher in a government much more susceptible to pressure from organisations of the working-class, creating a space within which we can organise communities to push for real concrete improvements in people’s lives. And it would draw a clear line in the sand between those who are in favour of pro-working-class politics, and those who’ll devote their energies to propping up the interests of the elite - both inside and outside the Labour Party.  Make your vote a crowbar in the hands of your class - register to vote online before midnight tonight." True text
fullmarx 160742592914 "2017-05-16 20:35:32 GMT" http://fullmarx.tumblr.com/post/160742592914/if-youre-going-to-call-corbyn-a-pinko-commie "If you’re going to call Corbyn a pinko commie bastard for introducing a 45% top rate of tax and renationalising the railways and the post office, then by your logic, Maggie Thatcher (60% top rate of tax, retained the Post Office and the railways as fully publically owned) must have been a resident of Joe Stalin’s undercrackers." True text
fullmarx 160741695319 "2017-05-16 20:07:29 GMT" http://fullmarx.tumblr.com/post/160741695319/chelsea-manning-leaked-footage-of-civilian "Chelsea Manning: leaked footage of civilian murders by US troops, internal communiques between diplomatic staff and logs of military engagements to carefully selected media organisations who analysed, vetted and censored information to scrub it of all potential to put lives at risk - in the name of public transparency and accountability. Punishment: held for three years without trial in various Marine and military prisons whilst being treated as the wrong gender, finally sentenced to 35 years in prison for military espionage; later commuted to seven years. Donald Trump: divulges highly classified information directly to the Russian foreign ministry, jeopardising intelligence sources within ISIL-held territory and directly endangering lives - as a deal-sweetener to curb Russian aggression in the region. Punishment: none, so far." True text
fullmarx 160670198429 "2017-05-14 21:13:06 GMT" http://fullmarx.tumblr.com/post/160670198429/a-bugs-life-1998-or-as-it-should-be-known "A Bug’s Life (1998) Or, as it should be known, Ants Ants Revolution" True text
fullmarx 160483702649 "2017-05-09 17:08:31 GMT" http://fullmarx.tumblr.com/post/160483702649/theresa-may-has-announced-that-if-she-remains "Theresa May has announced that, if she remains Prime Minister after June 8th, her government will aim to overturn the ban on hunting foxes with hounds which was introduced in 2004. Personally, I have a big problem with this. It’s not that it’s a staggeringly cruel blood sport in which animals are encouraged to rip one another to pieces. It’s not that it’s an environmental nightmare, where large hunts and shoots - replete with culvert-wrecking SUVs - can wreak havoc with local ecosystems in the name of bogus ‘conservation’. It’s not that it’s a net-drain on local economies, generating only a handful of part-time jobs which often pay only ‘tips’ from landowners rather than actual lasting contracted jobs - with hunt-goers preferring posh champagne picnics over local produce. It’s not even that it’s an antiquated social ritual with its roots in the imagined feudal past, which evolved as an elaborate ruling-class masquerade to display exclusive land rights over those of their tenants to other wealthy landholders. It’s that I positively, deeply, truly, can’t abide knowing that at any given moment, somewhere in the leafy dells of the Costwolds or on the weathered moors of the Peak District, an inbred plutocrat is having fun." True text
fullmarx 160416160944 "2017-05-07 20:16:59 GMT" http://fullmarx.tumblr.com/post/160416160944/a-vital-part-of-being-an-ally-is-accepting-that "A vital part of being an ally is accepting that your viewpoint is shaped directly by your experiences of gender, sexuality, race and ability - and that those very experiences of being straight/white/male etc inculcate in us a sense that our opinions on the struggles of others must always be correct. Repeat after me: I am not always right. I will listen to the experiences of those who face oppressions which I don’t. Just because I am feminist/pro-LGBTQ/anti-racist does not mean I cannot unthinkingly reproduce forms of oppression." True text
fullmarx 159981663629 "2017-04-25 17:21:19 GMT" http://fullmarx.tumblr.com/post/159981663629/whenever-i-have-a-curry-and-whenever-i-go-around "Whenever I have a curry, and whenever I go around a museum, and whenever I hear the Proms on the radio, I’m reminded that the main impact of the British Empire on domestic culture was that it took lots of bits of other people’s countries, and rearranged them all into something not quite as good." True text
fullmarx 159944923479 "2017-04-24 17:45:37 GMT" http://fullmarx.tumblr.com/post/159944923479/commissarchrisman-why-do-rural-areas-tend-to "commissarchrisman: Why do rural areas tend to lean towards far right parties? Like I can kinda understand with the UK given the Tory party’s historical association with landowners, but that won’t be the case everywhere while rural far right voting tends to be a common trend. Marx put it succinctly: “The idiocy of rural life”. Although that’s somewhat of a sharp phrase to our modern ears (and Marx was arguably quick to dismiss the struggles of rural workers as against those of the urbanised proletariat), he had a kernel of a point. Agricultural working-class communities are often highly fragmented in terms of their class makeup, with distinctions between landowners and tenants blurred by feudalistic bonds of patronage and familial ties, and even modern agricultural communities are often diverse in their political formations, with some families and groups maintaining political hegemony over organs like parish councils and communities boards.As well, it’s important to realise that rural communities are often highly monocultural. Taken alongside the well-documented tendency for anti-migrant sentiments and racism to proliferate in areas where there is little immigration or mixing of ethnicities, and the failure of workers organisations to effectively overcome obstacles to rural organising, it’s possible to see how rural working-class communities have become somewhat of a natural constituency for far-right groups.That said, where pro-working-class organisations have effectively combated the challenges to organising rural workers, or where pre-existing democratic traditions have been harnessed to generate new forms of solidarity, particularly in the Global South, they have often become heartlands of revolutionary movements, cf. Cuba, the FARC in Colombia, the Indian Naxalites, Native American advocacy groups in the USA, etc etc.Source: I grew up in Tory-voting Buttfuck, Nowhere." False text
fullmarx 159912036149 "2017-04-23 20:37:01 GMT" http://fullmarx.tumblr.com/post/159912036149/its-a-truism-that-straight-white-men-are-a "It’s a truism that straight, white men are a minority globally. But it’s important to realise that we are - and always have been - a minority in the nations where we live. Right-wing ideologies which seek to promote and ‘defend’ the interests of 'white workers’, or those of men as against those of women, are fundamentally anti-democratic, and - nine times out of ten - mask acquisitive political projects by the twisted, rabidly anti-worker elites generated by decaying neoliberalism. Come on, lads. Don’t be fooled by this divisive horseshit." True text
fullmarx 159881107439 "2017-04-23 00:46:43 GMT" http://fullmarx.tumblr.com/post/159881107439/from-the-desk-of-full-marx-im-sorry-ive-been "From the desk of Full Marx: I’m sorry I’ve been lax in providing up-to-the-minute comment, analysis, discourse, memes and snark on current events and working-class history recently - my new job has had me working 14-hour days, which leaves barely enough time and energy to eat, let alone put together a cogent spike for the establishment. Thank you for your patience and forbearance. Theresa May and her pals in the Blairite wing of the Parliamentary Labour Party are on notice: counter-hegemonic service will be resumed shortly." True text
fullmarx 159689565004 "2017-04-17 20:42:24 GMT" http://fullmarx.tumblr.com/post/159689565004/baby-boomers-worked-the-9-to-5-millennials-work "Baby boomers worked the 9 to 5. Millennials work the 7 to 5 for minimum wage, followed by a 8 to 12 split shift with a 6 til close on the pot wash, followed by an open shift which violates your legal minimum time between shifts, followed by…" True text
fullmarx 159483758484 "2017-04-12 08:20:41 GMT" http://fullmarx.tumblr.com/post/159483758484/sean-spicers-erasure-of-the-nazis-use-of "Sean Spicer’s erasure of the Nazis’ use of chemical and biological weaponry - and with it, the legacy of the genocide perpetrated against European Jews - was not a ‘gaffe’ or an ‘awkward moment’. It’s a symptom of the detachment of Trump’s far-right inner circle from reality - where Holocaust denial and Breitbart ‘fake news’ overlap in the White House’s dank backrooms. I’ve written extensively elsewhere about how Trump is not a fascist - irrespective of his wannabe-Führer posturing - but Spicer’s bizarre mental gymnastics demonstrate the extent to which Trump’s senior team are tolerant of, and permeated by, those with neo-Nazi and 'alt-right’ sympathies. Trump has not so much drained the swamp as ushered the pondlife into special advisor roles." True text
fullmarx 159309372159 "2017-04-07 19:00:11 GMT" http://fullmarx.tumblr.com/post/159309372159/since-the-president-of-the-united-states-donald "Since the President of the United States Donald Trump is having an official meeting with China’s premier Xi Jinping (who doesn’t play golf) at his golf course resort this week, I wonder if they’ll be discussing their mutual acquaintance Eric Prince, formerly of Blackwater, the private security service used as arms-length deniable ops in Iraq and the Middle East, who is an unofficial advisor to the Trump campaign, and who has been contracted to the Chinese government’s security forces, and who has been implicated in opening unofficial back-channels with the Kremlin? (For more on this, have a listen to the ‘Trump’s Secret Prince’ episode of Jeremy Scahill’s fantastic investigative Intercepted podcast)" True text
fullmarx 158485228224 "2017-03-16 20:37:01 GMT" http://fullmarx.tumblr.com/post/158485228224/q-how-do-you-enforce-and-support-socialism "Q: How do you enforce and support Socialism without violence? [from Redditor beernsleep] FM: No society can function without a degree of coercion - only some of which is violent. Socialism seeks to minimise the degree of coercion (and violence) by democratising human organisations which produce value (ie. the ‘means of production’), and by devolving legislative power to the widest possible base in society (ie. the full participation in citizens in the creation of laws which shape their lives).  This means that the state is still a class structure - in that it represents the collective interests of a particular class - but that its nature as a coercive guardian of the interests of capital and profit has been replaced by its role as a co-ordinator for democratically agreed economic plans, and as a facilitator for the widest degree of democratic involvement. At the same time, I would expect the formal means of disciplining the working-class, ie. the police, the court system and the prisons, to be disbanded wholesale: to be replaced with locally accountable public safety committees, deliberative justice panels and socially-orientated rehabilitation programmes. As such, socialism will seek that future socialist states will have the closest possible relationship with the class whose interests they promote: no longer will a separate caste of unelected bureaucrats have insular, antagonistic relationship with ‘the economy’; rather, I think we’d see workers and trade unionists be elected to oversight boards at all levels and the regular rotation of staff (have a read about Che Guevara’s time as Cuba’s minister for economics to see how he ran his staff, eg. a system of ‘demotions’ where state workers switched places with those several levels below them, non-material rewards for high performance etc). This does not mean that socialism is entirely non-coercive. Majority decision making (and even consensus decision making) is inherently coercive to some degree, since there will always be people in that minority, and who have to abide by decisions which they object to. And if those people are damaging and disruptive, I’m sure that there will be time where the coercive elements of society will sadly have to be used - democratised and fully accountable as they may be. But socialism seeks to consciously undermine the necessity even for democratic planning or statehood by opening the possibility to lay the foundations of a communistic utopia. Contrast this with the joyful and deliberate concentration of social power in the hands of a tiny elite which inevitably follows any free-market system, and you’ll see my point. Ask | Podcast | Support" True text
fullmarx 158373473869 "2017-03-14 00:39:55 GMT" http://fullmarx.tumblr.com/post/158373473869/given-the-second-referendum-on-scottish "Given the second referendum on Scottish independence announced by the SNP, and the immediate plan for a united Ireland put forward by the newly-significant Sinn Fein in the Northern Irish Assembly, the breakup of the United Kingdom before the end of the next UK government is now a political inevitability. In the absolute political paralysis over negotiation with the EU, typified by the last-minute, will-she-won’t-she pantomime about Theresa May officially announcing the triggering of Article 50, there is the massive opportunity for regional movements of the working-class to demand self-determination on their own terms: those of emergency nationalisations of major industries and the financial commanding heights, the immediate introduction of solid minimum wages of at least £10 an hour to stave off any further social disintegration of working-class communities, and the complete reversal of the last 40 years of disastrous neoliberal economic policies. When the elite is incapable of governing, ordinary people must take steps to ensure their interests. In this current uncertainty, huge opportunities to stamp our claim on the future lie - they depend entirely on creating cogent and combative political organisations rooted in working-class communities." True text
fullmarx 158314081839 "2017-03-12 16:38:46 GMT" http://fullmarx.tumblr.com/post/158314081839/q-so-i-understand-that-workers-control-of-the "Q: So I understand that “workers control of the means of production” isn’t considered the definition of socialism by Marxists, but it is part of it right? Like would a worker coop meeting with the community to decide production be considered socialism by Marxist? Or would it have to be a planned economy? [via Redditor dovah_kun] FM: Workers controlling the means of production pretty much is the definition of socialism as far as Marxists are concerned - but when we unpack that phrase it leads to a whole set of further political conclusions.Who are the workers in question? Do we mean just white, male, blue collar workers in industrial professions? I’d argue that representing the whole of the working-class entails the deliberate and conscious enfranchisement of women, LGBT people, PoC, people with disabilities and other ‘minorities’ (who in fact make up the vast majority of the working-class) with a revolutionary politics.What does control entail? Does it just mean nominal ownership within a centrally planned state bureaucracy? Again, I’d argue that democratic participation in the process of production at all levels is vitally and inescapably important - and I think that necessarily leads one to conclude that a significant degree of participative economic planning would be both inevitable and highly desirable for fulfilling human needs. But I don’t see any contradiction between direct community control of workplaces and higher-tier democratic forums for wider social planning - within a decentralised democratic polity (rather than states with rigorously defined and policed borders) it’s absolutely possible that we could have both a high degree of communitarian control of small and medium workplaces, with more comprehensive structures of planning for more complex large industrial combines in areas like transport, finance, energy and food.And, to get super meta, what do we define as the means of production? Would we just want those large industries to be democratised, with smaller enterprises left to be run by capitalistic methods? I’d argue that that would be a contradictory halfway house which would inevitably lead to the worst kinds of social strife and counterrevolution if it were adopted as anything but the most immediate transitional measure. The core function of capital is to concentrate wealth in the hands of the few, and should be frankly stamped out as a means of allocating resources, to be replaced by communitarian self management and democratic planning in all areas of economic life. As well, I think we’d also see the democratisation of hitherto private spaces: art, journalism, culture, literature, education, public safety, etc etc.So - here we can see that a simple maxim about 'workers controlling the means of production’ does in fact contain within it a comprehensive toolkit for a new kind of society. I hope that’s some food for thought.Ask | Podcast | Support" True text
fullmarx 158159169189 "2017-03-08 19:18:04 GMT" http://fullmarx.tumblr.com/post/158159169189/if-you-cant-square-opposition-to-bourgeois "If you can’t square opposition to bourgeois capitalist Zionism with unconditionally supporting the right of working-class Jews to self-determination, then you’re a nasty racist. No two ways about it." True text
fullmarx 158155921509 "2017-03-08 17:32:24 GMT" http://fullmarx.tumblr.com/post/158155921509/international-working-womens-day "fullmarx: The history of the working-class is in reality the history of working women. Under the dual koshes of class oppression and patriarchal discrimination, women have been consistently the motor of revolutions: in 1789, they marched on Versailles and brought King Louis back to Paris; their demonstration in Petrograd on this day in 1917 sparked the entrance of the masses into the Russian Revolution; in 1936 they formed the backbone of the Spanish democratic peasant economy; in 2016 they spearhead the columns protecting Rojava and Kobane’s fledgling republic from ISIS.In many countries, women make up the majority of trade union members, and the majority of strike days are taken by women. They glue society together with one hand, and fight for a bright new dawn with the other.Here’s to the women - truly kicking ass for the working-class." False text
fullmarx 158125923554 "2017-03-07 22:56:06 GMT" http://fullmarx.tumblr.com/post/158125923554/why-trump-is-not-a-fascist-yet "I think it’s a bit of definitional creep to define Trump as a fascist. A key definition of fascism which is often left out from liberal categories is the presence of a highly organised (if not paramilitarised) mass movement made up of an unholy alliance between the petit-bourgeois and the poorest elements of the working-class. This mass movement serves to allow fascist parties within bourgeois state institutions to wield a much greater degree of independence from the ruling class than they would otherwise be capable of, what Marxists call ‘Bonapartism’. Whilst this was absolutely present in fascist Germany and Italy (and to a lesser degree in Spain), Trump has no such organised support base - and is therefore much more a prisoner to the vested interests in the financial and industrial elite who seek to use him as a pawn.  Whilst Trump’s ideas are undoubtedly fascistic, and the vocalisation of this ideology within state institutions legitimises and emboldens neo-Nazis and white nationalists, hugely increasing the dangers which they pose to PoC, women and the organised labour movement, I think it’s a misreading of the class character of Trumpism to define it as explicitly fascist. This presents us with a very different set of immediate organisational priorities: organising oppositional groups to fight for working-class political interests across and between the divisions which Trumpism seeks to widen and concretise, rather than uncompromising people’s war - at this stage." True text
fullmarx 147840956784 "2016-07-23 10:39:49 GMT" http://fullmarx.tumblr.com/post/147840956784/imfs-christine-lagarde-to-stand-trial-over-340m "Fascinating to see how political circumstances can change. Dominique Strauss-Khan, former head of the IMF, can use his Old Boy networks to get away with all manner of fraud, harassment and sexual abuse. But when the chips are down and the female head of your organisation is making worrying noises about how the Europe-wide strategy of austerity-to-the-bone is undermining the foundations of capital? Throw her to the wolves!Also, note how all of these über-capitalists are all members of the French Socialist Party. Social democrats make the most effective custodians of the status quo. Just remember what happened to the Girondins in 1794…" True link
