linguisten 160941916310 "2017-05-22 08:55:03 GMT" http://blog.linguisten.de/post/160941916310/an-investigation-into-the-origin-of-piedmontese "missalsfromiram: So the other day I found out that the Piedmontese language has a schwa sound after which consonants are automatically doubled (in a remarkable parallel to some Austronesian languages). But Wikipedia didn’t say how this schwa originated, and I wanted to know. The sources Wikipedia cited were all in Italian and the one English source was very general. I wasn’t able to find any sources of the phonological history of Piedmontese via Google, either. So, I decided to apply a bit of the comparative method myself to find out where this Piedmontese schwa came from. From Wikipedia, “Piedmontese language”: Pmnt vënner, It venerdi, L veneris diēs From Wikipedia, “Romance languages”: Pmnt vëdde, It vedere, L vīdēre Pmnt sëcca, It secca, L sicca  From The Global Lexicostatistical Database: (This source claims that the orthographic double consonants in Piedmontese are not phonologically geminated, but I don’t believe it) Pmnt sënner, It cenere, L cinerem Pmnt pëss, It pesce, L piscis  Pmnt cël, It quello, L ecce illu and eccu illu respectively From the Piedmontese Wiktionary test project: (There are certainly more than this but I only had the energy to look through the entries for A to D) (There were also a couple entries here that listed the pronunciation as lacking actual gemination, but…I’m going on the assumption that even if modern varieties lack it, the orthographic doubling indicates the presence of historical phonological gemination.) Pmnt bëscheuit, It biscotto, L biscoctum  Pmnt bachëtta, It bacchetta  Pmnt acutëssa, It acutezza  Pmnt chërse, It crescere, L crēscere  Pmnt chërpo, It carpine, L carpinus  Pmnt chërdo, It credo, L credo (fascinatingly, the Piedmontese cognate does not mean “creed”. It means “moment”, “interval”, or “instant”, and the religious terms àmen and ave have gone through the same semantic shift, perhaps in reference to the amount of time needed to say a creed, or an “amen” or an “ave”) Pmnt chërde, It credere, L crēdere  Pmnt carëssé, It accarezzare  Pmnt cëttì, It zittire  Pmnt crëstà, It crestato, L cristatus  Pmnt cravëtta , It capretta, L *caprittam  Pmnt dësgreghé, It disgregare, L disgregāre  Pmnt ëd, It di, L dē  Whew! Okay, so as you can see, a few terms don’t have Latin ancestors, either because I couldn’t find them, or because as far as I can tell the morphology involved in the Italian and Piedmontese cognates had never been productive with the ancestral root word in Latin. So, firstly, it seems that a lot of Piedmontese /ə/ came from unstressed long or short /e/ or /i/ in particles (cël, ëd) - initially I thought this applied to vowels in derivational affixes like dës- and -ëssa but then I realized that those affixes and their Italian/Latin equivalents are stressed, so the stress explanation couldn’t work for those. Secondly, it seems that Wikipedia’s claim that “The double consonants of Piedmontese exist only after stressed /ə/, written ë, and are not etymological” is not only not always true but actually somewhat backwards. It appears that many instances of Piedmontese /ə/ are actually caused by geminates, either original or developing later in Romance, as in L sicca > Pmnt sëcca, L   -ittam > Pmnt -ëtta, L -itiam > Pmnt -ëssa, or L piscis > Pmnt pëss. Thirdly, it seems that, beyond geminates, Piedmontese /ə/ comes from Latin short or long /e/ or /i/ before consonant clusters in general, e.g. L crestatus > Pmnt crëstà, L disgregāre > Pmnt dësgreghé, L biscoctum > Pmnt bëscheuit, or L crēdere > chërde. However, there are still some instances of Piedmontese /ə/ in this sample that cannot be readily explained, such as sënner, vëdde, and vënner. In these examples, neither /ə/ not the geminate is etymological. It would be simpler to assume that the geminate triggered the shift from a front vowel to schwa, as in the other cases, but that leaves unexplained where the geminate comes from. Nonetheless, I propose that the geminate consonants in these examples predated and caused /ə/. Further research may elucidate the origin of the geminate consonants in these words. Another change notable in this sample of words is a KreC > KerC shift (with “C” standing for any consonant) as seen in L crēdere > Pmnt chërde, L credo > Pmnt chërdo, L crēscere > Pmnt chërse, and L *caprittam > Pmnt cravëtta. The schwa in chërpo may be an analogical development, resulting not only from the resemblance of chërpo (“common hornbeam”) to KerC-shifted words, but also from the fact that it is also a botanical term like cravëtta (which refers not only to a young female goat but to several species of mushrooms); likewise, chërse (“to grow”) is also closely associated with plants. This KreC > KerC shift may allow us to date the approximate occurrence of the front vowel > schwa shift, or at least put it in its place in the ordered sequence of sound changes between Latin and Piedmontese. As seen in the examples of crēdere > chërde and credo > chërdo, the KreC > KerC shift could not have happened before the palatalization of Latin /k/; if it had, the Piedmontese reflexes of crēdere and credo would begin with /tʃ/. The alternative explanation - that /e/ shifted to /ə/ before the palatalization of Latin /k/ - is not only implausible on account of how extremely early it would place the /e/ > /ə/ shift, but also due to the fact that such a shift would have no clear explanation. Placing the KreC > KerC shift after the palatalization of /k/ and before the front vowel > schwa shift provides a clear explanation of both the preservation of /k/ and the shift of /e/ to /ə/, as the KerC-shifted outcomes of crēdere and credo contain a consonant cluster /rd/, and consonant clusters are shown in other words to trigger the shift of front vowels to schwa. In conclusion, by comparing a small sample of Piedmontese words to their Latin ancestors and Italian cognates, we can see that Latin /i/ and /e/ shifted to /ə/ in Piedmontese under two different conditions: in unstressed particles, and before consonant clusters, including geminate consonants. The shift of /i/ and /e/ to /ə/ under the latter condition occurred after a KreC > KerC shift, which in turn occurred after the palatalization of Latin /k/ before front vowels. Wow! Okay, that turned out way longer than originally planned. What’s funny is that I’m doing this “original research”, but probably these sound changes (assuming they’re even accurate) have already been discovered and described in published literature by one or more Italian scholars and I’m just unaware of it. Sometime I should actually undertake a serious search for physical-book sources on Piedmontese, whether in English or Italian, so I can find out for real whether these changes have already been described or not. " False text
linguisten 160939581950 "2017-05-22 06:44:02 GMT" http://blog.linguisten.de/post/160939581950/the-relationship-between-gesture-and "superlinguo: It’s easy to see the relationship between speech and gesture; people move their hands while they speak. There is also a more fundamental relationship between gestures and thinking, a relationship that is possibly even more primary for gesture than that with speech. Earlier this year a Sotaro Kita, Martha W. Alibali and Mingyuan Chu published a paper that brings together a lot of excellent research to discuss the role that gesture  has in thinking and speaking. As Kita tweeted when it was was published in January, this paper brings together 20 years of research and 10 years of writing. The authors draw on an extensive background literature, which includes their own extensive and excellent research (you may remember Kita’s work from the ‘Blind people gesture’ post, and Alibali’s work featured in an earlier post about unhelpful gesturing). If you only read one survey paper on the relationship between gesture and language, this is certainly a good one. But reading papers about gesture is my day job, not yours, so I’ve summarised some of the good bits for you. Introducing the ‘Gesture-for-Conceptualisation’ model In this paper the authors argue that the main function of gesture is to help the speaker conceptualise what they are thinking about, and therefore going to speak about. The authors argue that gestures are “physical actions of a special type” (p. 1), which means that gesturing about moving a mug of coffee is linked to the action of moving coffee as much as it is talking about moving the coffee, and that makes gestures particularly important in conceptualising tasks, and also talking about them.  They argues that there are four main ways gesture affects cognition to help conceputalise thought: (1) activation, (2) manipulation, (3) packaging and (4) exploration. All may occur in the one gesture, or one function may be more dominant at a particular time. I’ll go through each of these briefly. I often talk about the relationship between language and gesture being very close, so at the end I’ll also look at what the authors say about why gesture is at an earlier stage of cognition than spoken language might be.   Gesture activates cognition: Gesturing while thinking silently   The authors present evidence from experiments that show people gesture when  thinking about problems, even if they are not speaking and are by  themselves, and that these gestures can help people perform better certain kinds of  mental tasks that involve thinking about the manipulation of real or imaginary objects. Being allowed to gesture means people in experiments tend to think out  solutions to problems using more space and movement, people who aren’t  allowed to gesture tend to use more abstract ways of talking through the  problem. This means that gesture plays a more central role in cognition than just being linked to one other cognitive skill, like language or problem-solving, which is how it has been discussed in earlier work.  The authors argue that gesture can help with cognition because it represents information about objects and their manipulation in a more “schematic” way than other cognitive processes, stripping out a lot of potentially unnecessary detail.  Gesture manipulates cognition: People gesture more while dealing with complex spatial/motion information Not only do people gesture more in these tasks, but in one set of experiments people who performed more gestures do better in later attempts at the task, even when they’re told not to gesture on the second attempt - indicating there is some ongoing benefit to cognition, manipulating their cognitive skills at the task.  Gesture packages cognition: Changing the way people gesture changes their language Gesture can package information about space and movement. In one experiment researchers used this to manipulate how people used language to discuss an event. By asking the participants to gesture about specific features of the event, they could also shift the language that the speakers used. Also, the more information that there is to be packaged up into speech in a task, the more gestures people tended to use, to help them package up all that information.  Gesture explores cognition: Trying out ideas before you even say them There have been a number of studies that show that when people are learning about a new concept (particularly school-age children), there is a phase where there is a ‘mismatch’ between what they’re talking about and their gesture. For example when a young child sees water from a tall, narrow glass poured into a wider glass, the child will often say there is less water in the second glass, because the level is lower. If the child makes a hand-spreading gesture while saying this though, it is an indication that the child is beginning to understand that there’s actually the same volume of water, held in a different shape. Difficult  tasks can lead to a speech/gesture mismatch, which the authors argue is the brain trying out ideas  that aren’t expressed in speech. They also suggest that half-finished gestures may be an indication that the brain is abandoning ideas,  indicating unsuccessful exploration. My favourite quote from this part of the paper: “The key features of these phenomena are that the microgenesis of ideas in gesture is, to some extent, independent from (and blazing the trail for) the microgenesis of ideas in speech, and that ideas develop in gesture via a process of trial and error” (p. 9) Gesture is linked to other ‘practical actions’ The authors argue that gestures share features in common with other practical actions that we do with our hands and other parts of the body. They make a number of observations on this point:  People gesture more when talking/thinking about things that involve movement Gesture rates also affected by how easy it would be to manipulate the objects being gestured about. In their example a picture of a spiky mug propted fewer gestures in a rotation task than a smooth mug (because who the heck would want to touch an ouchy mug?) If people have experience manipulating the object being discussed then they gesture about it more But, they note that there are some extra things that gestures can do for cognition that actions don’t. Firstly, because gestures have this ‘schematising’ function, they have a stronger influence on thought and they’re better for making generalisation while making relevant information more flexible and efficient. Secondly the authors argue that gestures can affect through more strongly than actions. In a map recollection task people who gestured to remember the route did better than people who drew it. They also discussed research on expert users of abacuses, who calculate faster with an imaginary abacus BECAUSE REAL ONES SLOW THEM DOWN TOO MUCH . Kita, Alibali and Chu didn’t write that all in capitals, but I’m still blown away by the idea that reality is holding back calculation.  They do note that it’s possible that sometimes schematic representations in gesture may not have the relevant information, or be distracting, but setting up an experiment to confirm this would be difficult.  But Lauren, don’t you always say that gesture and speech are closely linked??? I do, and they are. Kita, Alibali and Chu discuss this too: “We argue that this occurs because the action generation system and the speech production system are highly interactive. As proposed by Kita and Özyürek (2003), the two systems can exchange information and align their contents. Thus, the contents of concurrent gesture and speech tend to converge.” (p. 11) That is, gesture and speech are very closely related, but before that gesture and thought are very very closely related, and because speech is also linked to thought, it all tends to come together so quickly that it’s taken them decades of experiments to start pulling these relationships apart.  They also discuss how their model fits with some other research that looks at the relationship between gesture and language. For example, it’s been observed that gesture helps with retrieving words when you can’t quite remember them. The authors of this paper argue that this fits with their model, because the ‘activation’ function of gesture can retrieve a representation of an item or a feature of it, which then activates associated information such as the name for it. There has been a great deal of research that indicates that gestures are useful for the people that we are speaking to, not just our own thinking. The authors of this paper don’t deny that that may be the case, instead arguing that it is possible for gestures to be both self-oriented and have a communicative function. Indeed, the schematisation that is beneficial for the speaker’s cognition may also be what is so useful about them for an interlocutor. They also argue that this still works for objects that we have no direct experience interacting with, because we are also able to navigate a  “virtual environment” of experiences.  One final great quote from the paper that sums it all up “By schematizing spatio-motoric information for these four functions, activation, manipulation, packaging and exploration, gesture facilitates cognitive processing and generates novel ideas, strategies and solutions that are easy to process, adaptable, and generalizable.” (p. 14) Reference: Kita, S., Alibali, M. W., & Chu, M. (2017, February 27). How Do  Gestures Influence Thinking and Speaking? The  Gesture-for-Conceptualization Hypothesis. Psychological Review. Advance  online publication. http://dx.doi.org/10.1037/rev0000059 " False text
linguisten 160936091929 "2017-05-22 04:33:06 GMT" http://blog.linguisten.de/post/160936091929/brisbone-i-work-at-a-catholic-hospital-and-im "brisbone:  I work at a Catholic hospital and I’m at lunch and I overheard one of the priests at the next table say “A priest, a deacon and monk came down to my office…” I started listening because I thought he was telling a joke but he was just talking about his day lmao. " False text
linguisten 160931872011 "2017-05-22 02:22:10 GMT" http://blog.linguisten.de/post/160931872011/socotic-sometimes-i-forget-how-to-spell-a-word "socotic: sometimes i forget how to spell a word so i change the whole sentence to avoid using it " False text
linguisten 160927862031 "2017-05-22 00:11:13 GMT" http://blog.linguisten.de/post/160927862031/by-deciphering-the-texts-body-you-become-its "e-stranger: This image shows an interpratation of the word marrow in Bliss-characters of a poem in English. Samantha Gorman used Bliss in her project Lingua Ignota (2009 -?). In the project a poem was  converted back and forth between English and  blissymbolics over three rounds of translation and negotiating consensus by diverse participants.  In this proces, as I understood it, mostly done via an online apparatusI approach you in the metonymy of another language. (line 6 of the poem)becameI travel toward you escaping the homeland of my story. andBy deciphering the text’s body, you become its marrow. (line 12 of the poem)became By cutting the book, you break into its spine. Gorman’s work reads as a delicious game of translation and poetry, but for me it does more. These days I am interested in what is called Agency Art (coined by Arjen Mulder in the article The Beauty of Agency Art from 2012. I like this concept very much - it doesn’t take any technology or medium  as it’s starting point, but puts what these make possible in the  foreground. Following my interest I also read things about Bruno Latour who uses the term social agency in ANT (Actor-network theory).  Gorman’s piece echos in me what is called the proces of “translation” in  ANT. She says on het website: “Lingua Ignota is about a collaboratively authored  transference of lexical meaning between language systems.“ Isn’t that also what “agents” in  Latour’s theory do? Lingua Ignota is Agency Art.  " False text
linguisten 160907744325 "2017-05-21 13:16:52 GMT" http://blog.linguisten.de/post/160907744325/thepraxianweasleygeek-fullychaoticpatrol-i "thepraxianweasleygeek:  fullychaoticpatrol: I love how it’s “The Strange Case of Doctor Jekyll and MISTER Hyde” as in, yeah, they are basically two sides of the same person but only ONE has a doctorate #unless your bitch ass second personality helped you write that thesis it is your fucking doctorate  " False text
linguisten 160893606835 "2017-05-21 02:22:20 GMT" http://blog.linguisten.de/post/160893606835/a-man-mansplained-linguistics-to-me "dollopheadclotpole:  I’m currently doing a PhD in linguistics. I have a BA and MA degree in linguistics. I am being funded by one of only seven research councils in the UK and was offered funding by another too.   Yesterday at a party I had to listen to a guy, who has never studied linguistics, tell me how women talk far more than men and “dominate” conversations.   Even when I tried to present him with studies that show that men typically hold 75% of conversations, will view a woman as dominating if she takes up more than 25% of the  conversation, and interrupt far more frequently than women, he would just talk over me to tell me all about how women talk too much.   He actually said at one point “women just talk loads and say nothing. Men don’t have to say much because we can just get our point across without the chat”.   All while he was giving me his opinion and refusing to listen to anything I had to say based on my 5 years of linguistic knowledge and 24 years of experience as a woman.   I mean…  " False text
linguisten 161052102703 "2017-05-25 08:54:51 GMT" http://blog.linguisten.de/post/161052102703/arabish-englic-or-englabic-the-english-arabic "kelseythelinguist:  The dialects are so different they could almost be classified as different languages. I was a little more familiar with Egyptian since my uncle is Egyptian. But, even then, whenever he spoke to me I only stared in ignorance and nodded when it seemed like it was an appropriate time to nod. The only Egyptian words I recognised were shib shib (flip flops), Izayik (How are you?), 3arabaya (car) and 3amlah eih (How are you?/What have you been up to?). But even when he would ask me “3amlah eih” I would respond with “homework” or “nothing,” thinking he was literally asking me “What are you doing?” And then after realising that what he was really asking me was “How are you doing?” - so then I would try to play it off.  " False link
linguisten 161030719605 "2017-05-24 19:49:37 GMT" http://blog.linguisten.de/post/161030719605/mommas-dont-let-your-babies-grow-up-to-be  True link
linguisten 161023531868 "2017-05-24 15:27:31 GMT" http://blog.linguisten.de/post/161023531868/can-prairie-dogs-talk "adtothebone: “To recognize that we are not alone, that we share our world with other conscious, thinking, speaking beings, requires us to sacrifice a great deal of ego. At the same time, it folds us, palpably and inextricably, into the fabric of a much grander universe.” A long but fascinating read, and I also appreciate the way that the New York Times integrated video and sound into the story. " False link
linguisten 161010066206 "2017-05-24 04:33:05 GMT" http://blog.linguisten.de/post/161010066206/how-emojis-can-save-your-relationship-and-help  True link
linguisten 160990464867 "2017-05-23 17:38:33 GMT" http://blog.linguisten.de/post/160990464867/korean-sign-language-is-an-official-language-in  True link
linguisten 160986940642 "2017-05-23 15:27:45 GMT" http://blog.linguisten.de/post/160986940642/ted-ed  True link
linguisten 160983764788 "2017-05-23 13:16:41 GMT" http://blog.linguisten.de/post/160983764788/baby-names-helping-indigenous-languages-live-on  True link
linguisten 160919368020 "2017-05-21 19:49:29 GMT" http://blog.linguisten.de/post/160919368020/theres-often-a-tension-about-a-whitefella  True link
linguisten 160902952424 "2017-05-21 08:54:45 GMT" http://blog.linguisten.de/post/160902952424/adopting-dual-language-programs-is-one-way-parish  True link
linguisten 160900383099 "2017-05-21 06:44:12 GMT" http://blog.linguisten.de/post/160900383099/the-government-has-a-plan-for-gaelic-and-you  True link
linguisten 160897145553 "2017-05-21 04:33:15 GMT" http://blog.linguisten.de/post/160897145553/10-business-cliches-you-should-eliminate-from-your "resumespeak:Taking my jargonizing to the next level" False link
linguisten 160890216730 "2017-05-21 00:11:23 GMT" http://blog.linguisten.de/post/160890216730/how-we-talk-about-colors "linguisten:  His And Hers Colors is a visualization project that elucidates the gender differences in how we identify color names. The results show that women are much more specific and poetic while talking about colors, while men are more direct.   http://www.datapointed.net/visualizations/color/men-women-color-names-d3/ " False link
linguisten 160882715993 "2017-05-20 19:49:22 GMT" http://blog.linguisten.de/post/160882715993/roses-are-red-violets-are-red-how-color-terms  True link
