lonniebegood 152939655650 "2016-11-09 08:01:43 GMT" https://lonniebegood.tumblr.com/post/152939655650/haleyjscott-nomatterwhatuniverse-let-me-be "haleyjscott:  nomatterwhatuniverse:  let me be quite clear about something if you support trump, unfollow me if you voted for trump, unfollow me if you’re in any way endorsing trump, a violent, misogynistic, white supremacist, rapist, racist, homophobic and transphobic piece of shit, unfollow me    " False text
lonniebegood 151518765275 "2016-10-08 16:00:58 GMT" https://lonniebegood.tumblr.com/post/151518765275/attention-all-artists "infinipede:  sheodraws:  You sure have seen this post. It has spread like wildfire over the past few days so I doubt there is any artist out there who hasn’t seen it. But even if you didn’t, you should read on because I’m about to tell you a handy little thing that can help you to protect your art from such assholes as the anon who submitted this bullcrap, as well as art thieves in general. The magic word is Metadata.  Metadata is like an invisible signature that is embeded into a file. It can contain all kinds of information, like Title, date, keywords for online seach engines, and copyright information. And the best thing is, since this information is “hidden” in the code of your picture, it’s hard to remove it. There is a nice basic tutorial on how to add Metadata, or “additional file information” to your images in photoshop. It’s really, really easy so check it out!  “Adding Your Contact And Copyright Info To Your Photos With Photoshop” on PhotoshopEssentials.com  I’m not sure if you can do the same with any other art program. If you know how to do this in other programs / can confirm that it works the same way there, please tell me so I can add the information to this post.  Adding the Metadata will not stop idiots from taking and reposting your art. It also won’t make them stop editing out your signature. It WILL however, help you prove that you are the original artist whenever you have to.Always remember my friends. You, the artist, are protected by law. No one has the right to take your intellectual property and hard work and repost, use or edit it without your permission. Ever.  art thief: well how can you prove its yours?? me: /opens metadata " False text
lonniebegood 151303772335 "2016-10-03 20:44:43 GMT" https://lonniebegood.tumblr.com/post/151303772335/britains-biggest-secret-the-black-victorians "scarabsi:  purpleolifant:   Pictured above is the Higdon family. This photograph was taken in the year 1898 in Britain. That is all we know about them. Who were the Black Victorians? Mainstream history has virtually erased them from our minds and history books. We have been filled with images of slavery in America and across the world, but why is it that this chapter in black history was skipped? Why isn’t it equally common knowledge that in the midst of all of that darkness there was light, also. Never before seen photos were uncovered, giving us over 200 images of glances into our past. Many of the photos did not include names or any details whatsoever, cloaking these people in mystery for all of time. At one point in history, people of color were included in high society and walked the cobbled streets of Britain. The women wore intricate, voluminous gowns and wore their hair in curls and chignons. The men in suits and fair business. This may not have been the case for all black people in Britain, but for some it was.  The Victorian Era was ruled under Queen Victoria, an era that is described as an opulent culture, although there were underlying bouts of poverty and child labor. History would like you to believe that black people didn’t arrive in Britain until 1948 during “The Empire Windrush”, when many Jamaican descendants entered the country, but that is not so. There has been proof to suggest otherwise. There is documentation that proves that it wasn’t uncommon to see black faces at a Shakespeare show. We’ve been there all along, humming softly in the background. These images prove that you can’t take mainstream history at face value. Take the time to look behind the curtain and uncover OUR history. It’s as if our ancestors are just waiting for us to seek them out. Who were the Black Victorians? To see more of these images check out this video reel.  https://www.youtube.com/watch?v=08mwrYUzPqI Happy Black History Month.  For those surprised by the existence of black people who aren’t slaves in history, there’s an entire blog about this very thing called @medievalpoc that gathers up historical proof of non-slave black people in Europe. " False text
lonniebegood 151124836210 "2016-09-30 01:27:55 GMT" https://lonniebegood.tumblr.com/post/151124836210/livebloggingmydescentintomadness "livebloggingmydescentintomadness:  livebloggingmydescentintomadness:  I don’t care if Hillary Clinton is corrupt. I don’t care if she lies, if she cheats, if she eats bowls of newborn chipmunks for breakfast. She is literally the only thing standing in the way of a fascist dictator becoming President of the United States with a Republican majority congress that guarantees he can do anything he wants and nothing will be able to stop him. I was and still am a Bernie supporter, and I hate a lot of things about Clinton, but none of that matters anymore. If Trump is elected, people are going to die. Women are going to die when Roe v Wade is overturned and Planned Parenthood is defunded. LGBTQ people are going to die when conversion therapy is further legalized and more bathroom bills are passed. POC are going to die as Trump rounds up Mexican immigrants, gives more power to the police, and fuels the fires of Islamaphobia. Poor people are going to die as Obamacare gets overturned and further cuts are made to welfare programs. And that’s just in this country. That’s not even taking account the all-too-likely outcomes of Trump starting new wars in the Middle East and having control of nuclear bombs that he’s said he ‘would not rule out’ using. This is no longer even about ‘the lesser of two evils’. This is not ‘scare tactics’. This is literally life and death. Don’t fuck around and tell me you’re voting third-party or not voting at all, because you don’t have that luxury.   I am delighted that this post has gotten as many notes as it has, but as Election Day grows closer I would like to flush it out with some additional information and facts, particularly for those people who are still considering voting third party and those who still consider Clinton “just as bad” as Trump. Why you shouldn’t vote for Jill Stein Why you shouldn’t vote for Gary Johnson Why you shouldn’t vote third party AT ALL: x, x, x, x (hint, it’s because the electoral college presently makes it impossible for third party to win) Worried about Clinton’s scandals? John Oliver breaks it down. Comparison of Hillary Clinton and Bernie Sanders’ views. They voted the same 93% of the time.  A comprehensive review of Donald Trump’s corruption Donald Trump is being sued for raping a 13 year old girl in 1994, and there is merit to the case. Oxford Economics predicts that Trump’s policies would remove $1 trillion from the US economy, while the Peterson Institute projects that a Trump presidency could cost nearly 5 million US jobs. Donald Trump repeatedly asked why the US couldn’t use nuclear weapons Donald Trump’s cruel streak 37 of the most offensive things Trump ever said   Donald Trump unveils plan to make abortion illegal again     Feds investigating Trump advisor’s meeting with Russian officials seeking to influence U.S. election (Trump called Putin a better leader than Obama.)     Trump’s campaign paid his businesses $8.2 million Trump flies in a plane with gold-plated bathroom fixtures and pays for it with tax dollars   Trump’s financial plan would increase the debt by $5.3 trillion above current levels, Clinton’s by $200 billion  Trump wants to eliminate food safety regulations Trump was sued by the Justice Department for housing discrimination against black people   Trump has reaped at least $885 million in tax breaks, grants and other subsidies for luxury apartments, hotels and office buildings in New York    Trump’s slimy, shameless approach to philanthropy  Concerned that Hillary Clinton defended a child rapist? She tried to get out of it, but she had no choice.  The official Republican platform includes banning abortion, overturning marriage equality, no background checks for purchasing guns, declaring coal “clean energy”, religion used as a guide for legislation, a border wall, and pornography declared a “public menace”. Politifact says that Hillary has made ‘false’ statements 11% of the time and ‘pants on fire’ statements 2%, compared to Trump’s 37% and 17%. Bernie supporter? Bernie says that now is not the time for a protest vote. Bernie tells you why you should vote for Hillary Clinton. Bernie says that Trump must not become president. Please do not waste your vote. You can complain about Hillary Clinton as much as you want, but complain about her while you vote for her. " False text
lonniebegood 150738995640 "2016-09-21 19:50:15 GMT" https://lonniebegood.tumblr.com/post/150738995640/httpscolonslashslash-whatever-is-pxre-when-i "httpscolonslashslash:  whatever-is-pxre:  When I was 13 years old and curious about sex and love, I asked my mom if she had had sex before marrying my father (of whom she is still married to, and has been since before I was born). She said that that wasn’t really a ‘yes’ or ‘no’ question. I said ‘sure it is, you’ve either had sex before him, or you haven’t’.  She brought me onto the couch and sat me down and told me about the boy she liked when she was young and how one night she snuck into his house while his parents were gone and they were kissing and he said they should have sex and she said that she wanted to save sex for marriage and he laughed and basically took all her clothes off and he raped her and as my mom was telling the story she cried and this was the second time I had ever seen my mom cry. She was 12 when it happened.  In grade 8 I got a call from my friend in the middle of the night and she was drunk in the park crying and told me that she went out that night with some other friends and they drank a little and her guy “friend” starting flirting and yes she laughed at first but then he tried to pull her shirt over her head and she pulled away and he ripped her shirt and it was her favourite shirt and then he pushed her to her knees and HIS BEST FRIEND HELD HER JAW OPEN WHILE HE FACE FUCKED HER. And so I went to the park and picked her up and took her home and slept in her bed with her except we didn’t sleep because she just cried and her mouth bled and this was four years ago but I still have to be the one to bring her items to the till it the cashier is a man, and she still has anxiety attacks and she’ll get a rash all over her body and I just want to kill those boys but instead they are still walking around. And I’m in the bathroom with her, dabbing at her skin with a warm cloth until it returns to its regular colour.  And in grade 9 one of my closest friends was kinda seeing this boy and so they hung out one night and then she said that she really had to be getting back home and he said that she wasn’t going anywhere until she gave him what he wanted and he parked the car and took off her clothes and she said no and he ignored her and so she laid in the backseat totally limp and just cried and it wasn’t even sex, he just masterbated by using her body instead of his hand and she came to school the next day with vodka in her water bottle and she drank all day and I had to fight her to get the alcohol away from her and she just cried and threw up and I skipped class while I held her hair back and that same boy texted me a month later, asking if I ever wanted to hangout sometime. And in that same year my very best friend who has never even kissed a boy, confessed to me that when she was 9 years old, her 12 year old cousin made her give him a hand job and he told her that was what cousins do and he gave her a chocolate bar afterwards and she told me that he probably doesn’t even remember it but that it’s something that she’ll never have the luxury of forgetting.  And in grade 10 I knew a girl who invited her best friend over to watch Disney movies and then he started to put his hands down her pants and she said no but she is 130lbs and he is 220lbs and he called her a tease while she tried to fight him but he used one hand to hold her down, and the other to put inside of her and i was the one to push her inside of a classroom and stand in front of her while calling the police when he showed up at our school looking for her and she was so damn scared.  And a few months later I skipped class and was in the car with a guy who i had had unprotected sex with in the past while under the influence of cocaine but this time I was sober and I insisted we use a condom but he told me he couldn’t feel anything while the condom was on so he ripped it off and I said I refused to have unprotected sex again and so he just grabbed me and forced himself into my mouth and I was crying and he pulled me onto him and I just came saying “stop” over and over like a broken record but he must’ve heard something different because he went until he came and I just sat naked in the backseat while he drove me back to the school and said “we should do this again sometime”. And I had five showers that night and I scratched at my skin so hard to try and rip his fingerprints off of me, I still have the scars.  And I found out soon afterwards that that same guy had raped a classmate of mine, 5 months earlier and she told me about how he brought her McDonald’s first, and how he said they could take things slow and she told me about how he didn’t listen to her either. And he goes to our school and so after she told me about her incident and I told her about mine, we decided to report it to the police and the trial is currently still going on and he told people about it, except in his version we are just “asking for attention” and all his friends talk about how bad they feel for him. As if HE is the one that still wakes up screaming. As if HE felt like his skin no longer was beautiful, no longer belonged to him.  And I held her in my arms as she bawled after giving the police her statement. And she did the same for me.  And I met a woman a year ago in a paint store and she had a service dog and I asked what the dog was for and it turns out that she had been so brutally raped and abused in her life, that the dog is literally trained to keep men away from her.  And I’m so FUCKING SICK AND TIRED OF THIS WORLD WE ARE LIVING IN. How many rape victims eyes have I already looked into? How many more will I? And how many more friends will I hold while they shake? Because I don’t know how many more I can take. And who the fuck still has the nerve to make rape jokes? And… Something just has to change. Please, someone just start being that change.  -16 year old girl  Did I reblog this already I dont care " False text
lonniebegood 149794412570 "2016-09-01 14:32:13 GMT" https://lonniebegood.tumblr.com/post/149794412570/oregon-white-supremacist-chases-mauls-kills "ghettablasta:  Larnell Bruce was only 19, when he died with the hands of white supremacist couple:   Russell Courtier, Colleen Hunt. On Aug. 10 Larnell Bruce with his friends was in the parking lot chatting while Courtier and his gf drove up to the nearest convenience store. Almost immediately they started to argue and Courtier began to beat the kid up, while Colleen Hunt allegedly cried “Get him, baby, get him.“ The white man smashed Bruce’s head into the front window of the store when Bruce finally decided to pull out a knife to protect himself. That’s when the couple got back into their Jeep and started to chase the boy to run him over.  Bruce did his best to avoid death, but couldn’t manage to. Larnell Bruce, who suffered critical brain injuries, was found by police on the street with blood coming out of his head and ears.   Bruce’s mother Christina Mines just couldn’t believe THAT happened to her son. Family friend Vanessa Galindo adds the pain of Bruce being gone is tough.   Mines’ says she wants to see justice in her son’s death but at the same time forgiveness for the two charged in the case.   I do not forgive them. Such cruelty can’t be forgiven or forgotten! That’s too much! #StayWoke #WhiteSupremacy #HateCrime " False text
lonniebegood 149318919390 "2016-08-22 12:50:03 GMT" https://lonniebegood.tumblr.com/post/149318919390/broke-af "breelandwalker:  his-quietus-make:  avari20:  But still interested in feeding yourself? What if I told you that there’s a woman with a blog who had to feed both herself and her young son…on 10 British pounds ($15/14 Euro) per week? Let me tell you a thing. This woman saved my life last year. Actually saved my life. I had a piggy bank full of change and that’s it. Many people in my fandom might remember that dark time as when I had to hock my writing skills in exchange for donations. I cried a lot then.  This is real talk, people: I marked down exactly what I needed to buy, totaled it, counted out that exact change, and then went to three different stores to buy what I needed so I didn’t have to dump a load of change on just one person. I was already embarrassed, but to feel people staring? Utter shame suffused me. The reasons behind that are another post all together.  AgirlcalledJack.com is run by a British woman who was on benefits for years. Things got desperate. She had to find a way to feed herself and her son using just the basics that could be found at the supermarket. But the recipes she came up with are amazing.  You have to consider the differing costs of things between countries, but if you just have three ingredients in your cupboard, this woman will tell you what to do with it. Check what you already have. Chances are you have the basics of a filling meal already.  Here’s her list of kitchen basics.  Bake your own bread. It’s easier than you think. Here’s a list of many recipes, each using some variation of just plain flour, yeast, some oil, maybe water or lemon juice. And kneading bread is therapeutic.  Make your own pasta–gluten free.  She gets it. She really does. This is the article that started it all. It’s called “Hunger Hurts”. She has vegan recipes. A carrot, a can of kidney beans, and some cumin will get you a really filling soup…or throw in some flour for binding and you’ve got yourself a burger.  Don’t have an oven or the stove isn’t available? She covers that in her Microwave Cooking section.    She has a book, but many recipes can be found on her blog for free. She prices her recipes down to the cent, and every year she participates in a project called “Living Below the Line” where she has to live on 1 BP per day of food for five days.  Things improved for me a little, but her website is my go to. I learned how to bake bread (using my crockpot, but that was my own twist), and I have a little cart full of things that saved me back then, just in case I need them again. She gives you the tools to feed yourself, for very little money, and that’s a fabulous feeling.   Tip: Whenever you have a little extra money, buy a 10 dollar/pound/euro giftcard from your discount grocer. Stash it. That’s your super emergency money. Make sure they don’t charge by the month for lack of use, though.    I don’t care if it sounds like an advertisement–you won’t be buying anything from the site. What I DO care about is your mental, emotional, and physical health–and dammit, food’s right in the center of that.  If you don’t need this now, pass it on to someone who does. Pass it on anyway, because do you REALLY know which of the people in your life is in need? Which follower might be staring at their own piggy bank? Trust me: someone out there needs to see this.   Reblogging for all the impoverished students. Jack is the breadline queen. And if you don’t need this - donate to your nearest food bank, stat.  Reblogging for students, working folks, and everyone who’s ever had to choose between essentials at the store because you can only afford milk OR bread, not both. " False text
lonniebegood 149281091845 "2016-08-21 18:48:08 GMT" https://lonniebegood.tumblr.com/post/149281091845/some-artist-tips-you-may-or-may-not-know "ashalina-art:  Just from personal experience. 1: Never try to draw on an empty stomach. You’ll make mistakes and be uncomfortable. (But don’t stuff yourself till you’re sick either.) 2: If you have to go to the bathroom, go. A full bladder or otherwise does serious damage to the attention and patience spans. Plus it gives you time to stretch your legs. 3: Before you ink it, leave it alone. Come back later (a few hours, a day?) and check for major anatomy mistakes. Work on something else while you’re waiting. 4: Stay hydrated! The brain and fine motor skills work better when properly circulated. 5: Do not have an excessive amount of sugar before sitting down to work. You’ll get jittery and impatient. Same goes for immense amounts of caffeine. 6: If you’re stuck, take a break to stand and stretch. Walk around the room. But don’t THINK of it as a break. Just take time to really focus on your body. Loosen it up, get a goooood long stretch and some deep breaths. (but don’t pass out!) It’ll jolt the mind awake and let you really relax a moment. 7: Keep. All. Your. Old. Art. I don’t care what it is. Keep it. Date it if it’s in your computer folders. Make a suitcase filled with it. (I personally have ALL my old art in a thick work folder.) 8: Keep your sketchbooks together, used and unused. If there’s a good sale on sketchbooks, get two or three! You won’t regret it later. There’s no such thing as too many. (I currently have about ten spankin’ new sketchbooks and I know I’ll need/use every single one of them.) 9: Date your sketchbooks. Put a start and finish date on them. 10: I’m afraid I don’t practice this one: date your drawings. You’ll be happy about it later. You don’t need to SIGN every drawing, but do date them. At least date pages. 11: ART BLOCK HAPPENS. Art block is pretty much a CONSTANT state of mind for artists. You’re never out of art block totally. But sometimes you get bursts of inspiration that make it feel like you’re out. So instead of feeling like you’re ill if you suddenly have artblock, remind yourself that this happens all the time, and you get out of it eventually, every time. c:> 12: If you’re REALLY stuck on some bad art block, do what I do. Draw a brain barf. This is where you take a blank sheet of paper, and you just LET your hand be A.D.D. Draw whatever comes to mind, as it comes to mind. in the middle of drawing a hippo in a top hat but you think of a jolly rancher riding a unicycle? Switch immediately. Let your brain just vomit all over the page. You’ll be surprised what comes up and what art block this can get you out of. It’s gotten me out of it various times. 13: Take advice from more experienced artists. But do NOT take everything as Gospel. Some people are just wrong. 14: HAND SHYNESS/ ART ENVY/ SELF CONSCIOUSNESS/ AND SKILL IMPATIENCE WILL EAT YOU ALIVE like a Titan. Do not let yourself get shy after looking at ‘better art’, do not let yourself think your art is worthless or your skills are worthless, and do not let yourself get frustrated that you cannot be at a higher skill level RIGHT NOW. Your brain will try to do this. All the time. Keep yourself in check. If you keep going at it, and keep working, you will get better. This is why you keep your old art. Look at it to remind you how far you’ve come. 15: Draw what you like. This is so important. (This does not apply for exploitative art. :l That’s just wrong. So long as you’re not targeting someone harmfully, I guess you’re fine.) But don’t let people’s preferences dictate what you can and can’t draw. Draw whatever the heck you like. Accept that no matter WHAT there will be someone out there that hates it. Always. This is just a fact of life. But don’t let it get you down. I would have stopped being an artist at day one if I had. 16: You never. Stop. Learning. Ever. You will be old and grey and still be learning new things. That’s okay. That’s the nature of art. Even the ‘pros’ don’t know everything. I hope these help someone out there~ " False text
