lonniebegood 149274983740 "2016-08-21 16:15:52 GMT" https://lonniebegood.tumblr.com/post/149274983740/beepboop-its-a-robot-story-time-i-work-in-a "beepboop-its-a-robot:  STORY TIME:  I work in a decent sized, local, indie bookstore. It’s a great job 99% of the time and a lot of our customers are pretty neat people. Any who, middle of the day this little old lady comes up. She’s lovably kooky. She effuses how much she loves the store and how she wishes she could spend more time in it but her husband is waiting in the car (OH! I BETTER BUY HIM SOME CHOCOLATE!), she piles a bunch of art supplies on the counter and then stops and tells me how my bangs are beautiful and remind her of the ocean (“Wooooosh” she says, making a wave gesture with her hand) Ok. I think to myself. Awesomely happy, weird little old ladies are my favorite kind of customer. They’re thrilled about everything and they’re comfortably bananas. I can have a good time with this one. So we chat and it’s nice.  Then this kid, who’s been up my counter a few times to gather his school textbooks, comes up in line behind her (we’re connected to a major university in the city so we have a lot of harried students pass through). She turns around to him and, out of nowhere, demands that he put his textbooks on the counter. He’s confused but she explains that she’s going to buy his textbooks.  He goes sheetrock white. He refuses and adamantly insists that she can’t do that. It’s like, $400 worth of textbooks. She, this tiny old woman, bodily takes them out of her hands, throws them on the counter and turns to me with a intense stare and tells me to put them on her bill. The kid at this point is practically in tears. He’s confused and shocked and grateful. Then she turns to him and says “you need chocolate.” She starts grabbing handfuls of chocolates and putting them in her pile.  He keeps asking her “why are you doing this?” She responds “Do you like Harry Potter?“ and throws a copy of the new Cursed Child on the pile too.  Finally she’s done and I ring her up for a crazy amount of money. She pays and asks me to please give the kid a few bags for his stuff. While I’m bagging up her merchandise the kid hugs her. We’re both telling her how amazing she is and what an awesome thing she’s done. She turns to both of us and says probably one of the most profound, unscripted things I’ve ever had someone say: “It’s important to be kind. You can’t know all the times that you’ve hurt people in tiny, significant ways. It’s easy to be cruel without meaning to be. There’s nothing you can do about that. But you can choose to be kind. Be kind.” The kid thanks her again and leaves. I tell her again how awesome she is. She’s staring out the door after him and says to me: “My son is a homeless meth addict. I don’t know what I did. I see that boy and I see the man my son could have been if someone had chosen to be kind to him at just the right time.” I’ve bagged up all her stuff and at this point am super awkward and feel like I should say something but I don’t know what. Then she turns to me and says: I wish I could have bangs like that but my darn hair is just too curly.“ And leaves.  And that is the story of the best customer I’ve ever had. Be kind to somebody today.  " False text
lonniebegood 152966324350 "2016-11-09 21:44:19 GMT" https://lonniebegood.tumblr.com/post/152966324350/mike-christian-sharia-pence-is-scarier-than "confrontingbabble-on:  “Pence is no Uncle Joe.His record as governor indicates that he  is willing to completely undermine the core values of a free country in  order to impose his own vision of theocratic control. While  Donald Trump is a bumbling political idiot, Mike Pence is actively  against the people and possibilities that we need to help America to  have a strong future. His career has been built on hateful exclusion,  not intelligent inclusion. Here are some things that every voter should know about Mike Pence: - Science and invention helped build America, but Mike Pence is 100% anti-science.  He chooses not to accept the preponderance of evidence that supports  anthropomorphic climate change, and he thinks schools should be required  to teach Christian “creationism” mythology alongside evolution in  science classrooms. - Mike Pence is anti-environment.  As governor, he has vetoed every piece of environmental regulation that  has crossed his desk. He doesn’t want the EPA to regulate greenhouse  gases, and he does want to open up pretty much every part of our country  to oil and coal companies. No more wildlands under Pence. He is one of  those irresponsible extremists who think that God gave us the world so  we could just use it up, and when it is all used up the second coming  will occur. There is no Biblical basis for this belief. - Females make up more than half of the American population, but Mike Pence is anti-woman.  He has said the Disney movie “Mulan,” which was based on a centuries  old Chinese poem, was the work of a “mischievous liberal” trying to  groom young children to accept women in combat. “Despite her delicate  features and voice, Disney expects us to believe that Mulan’s ingenuity  and courage were enough to carry her to military success on an equal  basis,” he wrote on his radio show’s website. - He obsessively pursues a personal vendetta to take Title X funding  away from Planned Parenthood because Planned Parenthood provides  abortion services. Title X money CANNOT be used for abortions. Abortions  are paid for by the recipient or through private, tagged donations.  Taking away Title X will not impact abortion services, but it would  leave thousands of women without access to cancer screenings or birth  control.  - Speaking of birth control, Mike Pence once again revealed his historical ignorance in saying that condoms are “modern” and “liberal.”   He thinks all women should be pregnant unless they can’t afford a baby,  in which case they should abstain from sex, even if they are married.  That’s right: sex is only for procreation in PenceWorld. If you can’t  afford the diapers, then hubby should be sleeping on the couch. - Mike Pence is also anti-gay,  to the point of denial. He doesn’t want the government to pay for  cancer screenings, but he does want the government to pay for abusive  “conversion therapy” programs that systematically undermine the victim’s  self-esteem, and then indoctrinate them into robotic gender-appropriate  behaviors. He has signed into law a bill that allows discrimination  against LGTBQ customers based on religious belief. - As governor of Indiana, Mike Pence was personally responsible for an outbreak of AIDS when he refused to allow clean needle exchanges for drug addicts. Instead, he asked people to pray for the addicts. - Mike Pence is racist.  He thinks there is “too much talk” about institutional racism in law  enforcement because “police officers are human beings.” His solution is  unity through “faith.” The Indiana governor has tried to prevent Syrian  refugees from settling in his state because the “pose a threat to safety  of residents.” Pence argued that his policy was based on fear, not  race, so it wasn’t discriminatory. A Federal Appeals Court dismissed his  racist arguments on October 3, 2016. - A Federal Court also had to block his bizarre anti-abortion law  that required burial or cremation for fetuses, whether miscarried or  aborted, no matter how far along the pregnancy had progressed.  - Mike Pence is pro-birth, but not pro-life.  He once funneled $3.5M dollars from Temporary Assistance to Needy  Families into programs that counsel against abortion. He wants those  women to have those babies, but he doesn’t care if the kids starve or  live on the streets afterward. - Mike Pence has refused to comply with federal guidelines aimed at reducing prison rape. When  you add it all together, you can see that the most dangerous part of  the Trump-Pence ticket is …that calculating quiet man who will be leading the charge from behind. Mike Pence is basically against anyone who is not white, conservative, Christian, and male. When  Mike Pence was a young lawyer on the rise, he challenged a longtime  Democratic congressman for a seat in a Republican-leaning Indiana  district. He seemed to have it in the bag until voters were stunned to  learn that he had been using political donations to pay personal  expenses including the mortgage on his house, his credit card bill,  groceries, golf tournament fees, and car payments for his wife.” http://www.smobserved.com/story/2016/10/10/opinion/mike-christian-sharia-pence-is-scarier-than-donald-trump/2081.html " False link
lonniebegood 152965561795 "2016-11-09 21:26:06 GMT" https://lonniebegood.tumblr.com/post/152965561795/trump-won-now-we-organize-to-block-him-every "thefingerfuckingfemalefury:  guardian: It happened. Now, here’s the plan.  THIS Now the most important thing is to do everything possible to block EVERY SINGLE SHITTY THING this repulsive vermin tries to accomplish  " False link
lonniebegood 143908558080 "2016-05-05 20:56:23 GMT" https://lonniebegood.tumblr.com/post/143908558080/a-massive-lake-underneath-antarctic-ice-could-be "elsajeni: revealmyselfinvincible:  garbagefingers:  HAVEN’T YOU READ ANY LOVECRAFT????   Look, go ahead, do science. Just take someone with you who speaks Norwegian, so if someone runs toward you explaining the plot of the film in Norwegian in the first two minutes, you will understand them and not blithely bring the murderous alien lakewater samples or whatever back into your lab.  Hell no I’ve seen “Thing” too many times." False link
lonniebegood 141718130250 "2016-03-26 13:50:43 GMT" https://lonniebegood.tumblr.com/post/141718130250/psa-that-shady-postcard-you-got-about-the-primary "thessalian:  steviemcfly: NYC followers: the Board of Elections sent out “correction” postcards to new voters (AKA Bernie voters) saying the primary is in September. It’s still April 19. You should still vote. In fact, bring two friends who weren’t going to vote as a “fuck you” to the people who were trying to trick young people out of voting in the first place. This election is getting dirtier and more disgusting every time I turn around and the primaries aren’t even over yet. " False link
lonniebegood 141254663475 "2016-03-18 13:59:00 GMT" https://lonniebegood.tumblr.com/post/141254663475/young-voters-are-failing-bernie-sanders-just-as "roserust:rasteralien:studentsforbernie:Unfortunately the numbers don’t lie, youth voter turn out is down since 2008. Young voters support Bernie Sanders in overwhelming numbers, 86-14 in New Hampshire. That is massive, even better than Obama. Still, we NEED TO VOTE. We NEED to stay ACTIVE and involved! This political revolution is to make OUR country a better place, we need to quit letting 65 year old voters decide the future of our country. PLEASE REGISTER TO VOTE IF YOU HAVE NOT DONE SO ALREADY! BERNIE SANDERS 2016!   REGISTER RIGHT HERE, DO IT TODAY, RIGHT NOW, DO NOT WAIT!I just registered, it took 5 minutes. All you need is a driver’s license or ID. I don’t like politics on my dash, but I’m reblogging this because no matter who you support, you should register to vote, and this post has a link that makes it very easy to get started.Please register. Please vote." False link
lonniebegood 140239530060 "2016-02-29 23:34:14 GMT" https://lonniebegood.tumblr.com/post/140239530060/how-bernie-sanders-could-win-super-tuesday-or "cameoamalthea:Please Vote!!!" False link
lonniebegood 140239513845 "2016-02-29 23:33:53 GMT" https://lonniebegood.tumblr.com/post/140239513845/advanced-warning-clinton-likely-to-build-lead "shm128iii: Definitely a good thing to read over before we all start having heart attacks on Super Tuesday. Super-Short Version: A lot of the states that are voting in the Primaries on Tuesday lean heavily towards Hillary, so there’s a good chance Bernie’s gonna look like he’s taking a huge hit this week. In the weeks afterwards, however, the states that have been leaning towards Bernie will have their Primaries, so he’ll make a comeback then… Assuming, of course, that we don’t all get discouraged from the Super Tuesday results and remember to vote. Apparently, the same thing happened back in ‘08, with Hillary gaining huge leads on Super Tuesday but Obama making a comeback afterwards to get the nomination. In any case, keep yer hopes up, no matter what happens on Tuesday! Oh, and once again… Make sure you go out and vote! " False link
lonniebegood 139850501740 "2016-02-23 14:40:04 GMT" https://lonniebegood.tumblr.com/post/139850501740/young-voters-are-failing-bernie-sanders-just-as "roserust:rasteralien:studentsforbernie:Unfortunately the numbers don’t lie, youth voter turn out is down since 2008. Young voters support Bernie Sanders in overwhelming numbers, 86-14 in New Hampshire. That is massive, even better than Obama. Still, we NEED TO VOTE. We NEED to stay ACTIVE and involved! This political revolution is to make OUR country a better place, we need to quit letting 65 year old voters decide the future of our country. PLEASE REGISTER TO VOTE IF YOU HAVE NOT DONE SO ALREADY! BERNIE SANDERS 2016!   REGISTER RIGHT HERE, DO IT TODAY, RIGHT NOW, DO NOT WAIT!I just registered, it took 5 minutes. All you need is a driver’s license or ID. I don’t like politics on my dash, but I’m reblogging this because no matter who you support, you should register to vote, and this post has a link that makes it very easy to get started.Please register. Please vote." False link
lonniebegood 139849019810 "2016-02-23 13:58:53 GMT" https://lonniebegood.tumblr.com/post/139849019810/young-voters-are-failing-bernie-sanders-just-as "studentsforbernie:  Unfortunately the numbers don’t lie, youth voter turn out is down since 2008. Young voters support Bernie Sanders in overwhelming numbers, 86-14 in New Hampshire. That is massive, even better than Obama. Still, we NEED TO VOTE. We NEED to stay ACTIVE and involved! This political revolution is to make OUR country a better place, we need to quit letting 65 year old voters decide the future of our country. PLEASE REGISTER TO VOTE IF YOU HAVE NOT DONE SO ALREADY! BERNIE SANDERS 2016!   REGISTER RIGHT HERE, DO IT TODAY, RIGHT NOW, DO NOT WAIT! " False link
lonniebegood 138952488675 "2016-02-08 23:12:03 GMT" https://lonniebegood.tumblr.com/post/138952488675/constance-wu-diversitydoesnt-mean-we-want "minoritiesinpublishing:  “[Diversity] doesn’t mean we want the white people to write Asian stories.  What I want is to foster the Asian-American writers and directors and  producers and actors…foster their stories to come into the spotlight a  little bit.” This explanation for the term “diversity” is very important. Please pay attention. " False link
lonniebegood 138575487995 "2016-02-03 01:09:33 GMT" https://lonniebegood.tumblr.com/post/138575487995/bernie-sanders-won-iowas-political-momentum-and  True link
lonniebegood 138095542330 "2016-01-26 17:51:26 GMT" https://lonniebegood.tumblr.com/post/138095542330/my-70s-health-nut-parents-didnt-vaccinate-me "ladymarianor:  talesofthestarshipregeneration: I am the ’70s child of a health nut. I wasn’t vaccinated. I was brought up on an incredibly healthy diet: no sugar till I was 1, breastfed for over a year, organic homegrown vegetables, raw milk, no MSG, no additives, no aspartame. My mother used homeopathy, aromatherapy, osteopathy; we took daily supplements of vitamin C, echinacea, cod liver oil.I had an outdoor lifestyle; I grew up next to a farm in England’s Lake District, walked everywhere, did sports and danced twice a week, drank plenty of water. I wasn’t even allowed pop; even my fresh juice was watered down to protect my teeth, and I would’ve killed for white, shop-bought bread in my lunchbox once in a while and biscuits instead of fruit, like all the other kids.We ate (organic local) meat maybe once or twice a week, and my mother and father cooked everything from scratch—I have yet to taste a Findus crispy pancake, and oven chips (“fries,” to Americans) were reserved for those nights when Mum and Dad had friends over and we got a “treat.”As healthy as my lifestyle seemed, I contracted measles, mumps, rubella, a type of viral meningitis, scarlatina, whooping cough, yearly tonsillitis, and chickenpox. In my 20s I got precancerous HPV and spent six months of my life wondering how I was going to tell my two children under the age of 7 that Mummy might have cancer before it was safely removed.So the anti-vaccine advocates’ fears of having the “natural immunity sterilized out of us” just doesn’t cut it for me. How could I, with my idyllic childhood and my amazing health food, get so freaking ill all the time?…My two vaccinated children, on the other hand, have rarely been ill, have had antibiotics maybe twice in their lives, if that. Not like their mum. I got many illnesses requiring treatment with antibiotics. I developed penicillin-resistant quinsy at age 21—you know, that old-fashioned disease that supposedly killed Queen Elizabeth I and that was almost wiped out through use of antibiotics.* “If you think your child’s immune system is strong enough to fight off vaccine-preventable diseases, then it’s strong enough to fight off the tiny amounts of dead or weakened pathogens present in any of the vaccines.” " False link
lonniebegood 137346918795 "2016-01-15 14:19:18 GMT" https://lonniebegood.tumblr.com/post/137346918795/what-to-do-when-youre-not-the-hero-any-more "professorfangirl:  bookgeekgrrl:  thewinterotter:   The rage that white men have been expressing, loudly, violently, over the very idea that they might find themselves identifying with characters who are not white men, the very idea that heroism might not be particular to one race or one gender, the basic idea that the human story is vast and various and we all get to contribute a page - that rage is petty. It is aware of its own pettiness. Like a screaming toddler denied a sweet, it becomes more righteous the more it reminds itself that after all, it’s only a story. Only a story. Only the things we tell to keep out the darkness. Only the myths and fables that save us from despair, to establish power and destroy it, to teach each other how to be good, to describe the limits of desire, to keep us breathing and fighting and yearning and striving when it’d be so much easier to give in. Only the constitutive ingredients of every human society since the Stone age. Only a story. Only the most important thing in the whole world. The people who are upset that the faces of fiction are changing are right to worry. It’s a fundamental challenge to a worldview that’s been too comfortable for too long. The part of our cultural imagination that places white Western men at the centre of every story is the same part that legitimises racism and sexism. The part of our collective mythos that encourages every girl and brown boy to identify and empathise with white male heroes is the same part that reacts with rage when white boys are asked to imagine themselves in anyone else’s shoes. Read more   “…because when you’ve been used to privilege, equality feels like prejudice.” and also “Capitalism is just a story. Religion is just a story. Patriarchy and white supremacy are just stories. They are the great organising myths that define our societies and determine our futures, and I believe - I hope - that a great rewriting is slowly, surely underway.”  ^^^^ YES. This whole thing is glorious. " False link
lonniebegood 135577034025 "2015-12-20 16:33:13 GMT" https://lonniebegood.tumblr.com/post/135577034025/marlon-jamess-next-book-will-be-an-african-game "medievalpoc:   The author tells Man of the World magazine he’s going to “geek the fuck out” and create his own fantasy series, kicking off with a book called Black Leopard, Red Wolf, which he describes as “an African Game of Thrones.” As James puts it, ""I realized how sick and tired I was of arguing about whether there should be a black hobbit in Lord of the Rings.  African folklore is just as rich, and just as perverse as that shit. We  have witches, we have demons, we have goblins, and mad kings. We have  stories of royal succession that would put Wolf Hall to shame. We beat the Tudors two times over.“But be warned, James is not using the word geek lightly;  this thing is going to be seriously nerdy. “One hundred pages describing  a village? Hell yeah,” he promises. “A big appendix on magic  techniques? Of course I’m gonna do it. Two hundred pages on a mysterious  dwarf race that lives underground? Fuck yes.” Get your d20 ready — this  world is going to inspire one hell of a role-playing game someday." False link
lonniebegood 135035774970 "2015-12-12 08:30:13 GMT" https://lonniebegood.tumblr.com/post/135035774970/california-becomes-first-state-to-make-sexual "feministlikeme: “The new law mandates all school districts that have made health a graduation requirement to lecture students about sexual violence prevention and affirmative consent starting next year. It also urges state education officials to include those topics to their high school health curriculum, Lisa Leff of The Washington Post wrote. The measure did not receive any opposition in the Legislature, and even nearly received a unanimous bipartisan backing.” About fucking time. " False link
lonniebegood 134802659340 "2015-12-08 18:24:33 GMT" https://lonniebegood.tumblr.com/post/134802659340/for-bernie-sanders-to-win-in-2016-his-young "localsadcat:vote in the primaries im begging u" False link
lonniebegood 134509199445 "2015-12-04 05:12:38 GMT" https://lonniebegood.tumblr.com/post/134509199445/science-finally-supports-that-we-are-all-born-as "superluminalflower:  the-descolada:  fuckyeahsexeducation: There’s been so many studies on this it’s ridiculous and I think we need to stop focusing on the why and just respect people’s genders and stop forcing gender roles on to people (and I totally see how a TERF could twist this so don’t even try). However, as a genderqueer person I do get a little joy from this. Now we just need someone science-y to point out sex is a construct. get fucked gender essentialists  someone send my dad this lmao " False link
lonniebegood 133046191635 "2015-11-12 03:56:23 GMT" https://lonniebegood.tumblr.com/post/133046191635/women-legislators-turn-the-tables-and-introduce "positivelypersistentteach: dynastylnoire:  lennybaby2:  stayingwoke:  danifran16:  torisoulphoenix:  quietstorm-thundathighs:  i-was-a-naive-prolifer:  “Ohio state Sen. Nina Turner (D) isn’t happy with bills that seek to control women’s access to contraception and abortion. She has joined a trend across the nation by introducing a bill that would require men seeking a prescription for erectile dysfunction drugs to see a sex therapist, receive a cardiac stress test and ‘get a notarized affidavit signed by a sexual partner affirming impotency.’ Sex therapists would be required to present ‘celibacy as a viable lifestyle choice.’” How do you like them apples, hm?  Bless her!  GET ‘EM!!!!!!!!  Awesome!  I love her.  She is no joke.  Yes!!!  BOOOOOOOOOOOOOOOOOOOOST EXPOSE THEM  I have followed her for a while (since I am from Ohio).  She is excellent in every way. " False link
lonniebegood 132814379450 "2015-11-08 19:03:03 GMT" https://lonniebegood.tumblr.com/post/132814379450/how-kate-beaton-does-money "beatonna: hello-the-future:I loved reading the Comics Journal interview with Kate Beaton because her description of life in rural Nova Scotia sounded very similar to life in rural Missouri. $$$" False link
lonniebegood 132163294510 "2015-10-29 19:36:28 GMT" https://lonniebegood.tumblr.com/post/132163294510/vampires-will-never-hurt-you-one-shot "junerevolver:Hey! Awesome news! My most recent self written/drawn/shaded/published comic, “Vampires Will Never Hurt You” is available for digital download on Gumroad! You can read it right away, without worrying about shipping, and get in one heck of a spooky mood!  I need it. " False link
