rafi-dangelo 160698614470 "2017-05-15 16:18:42 GMT" http://soletstalkabout.com/post/160698614470/north-carolinas-discriminatory-voting-legislation "The U.S. Supreme Court put the final nail in the coffin of North Carolina’s strict voter-identification law on Monday, rejecting a Republican bid to revive the measure struck down by a lower court for intentionally aiming to suppress black voter turnout.The justices left in place a July 2016 ruling by the Richmond, Virginia-based 4th U.S. Circuit Court of Appeals that voided the law passed by a Republican-controlled legislature and signed by a Republican governor.The appeals court found that the North Carolina law’s provisions “target African-Americans with almost surgical precision” and “impose cures for problems that did not exist,” concluding that the Republican-led legislature enacted the measure “with discriminatory intent.”(cont. Reuters) This non-ruling from the Supreme Court sets absolutely no precedent and has no implications for future cases of restrictive voting legislation, but it’s still a relief.  The way this SCOTUS is set up at the moment, there’s no certainty that the 4th Circuit’s ruling wouldn’t have been overturned and North Carolina would’ve continued it’s descent into the abyss of white paranoia and bigotry.I’m not going to take you back down all of the history.  I wrote about the Court’s neutering of the Voting Rights Act in 2013 and then I wrote about this very law coming out of North Carolina a few weeks later after basically being given the green light by the Court.  I just want to draw attention to the fact that the Conservative/Liberal balance of the Supreme Court in 2013 was the same as it is right now.  So, the Court that chunked the most important part of the Voting Rights Act of 1965 is basically the same Court that would have to rule on voting legislation coming out of North Carolina, legislation that the NC Congress and Pat McCrory pushed into law as soon as it became possible to do so under the weakened VRA.  North Carolina wanted to make it harder for minorities, young people, and older people to vote – all demographics that skew Democrat – and they succeeded.  The NAACP appealed and Circuit 4 ruled in favor of justice, so the law became null and void.  Then North Carolina appealed to the Supreme Court.  The reason this case is being thrown out is because of the bickering back and forth over who should be allowed to take responsibility for it.  This issue is a Republican cause and it has made its way to the highest court in the land on the backs of a Republican governor and a Republican attorney general.  Neither of those two people are in office any longer and the Democrats currently holding those posts in North Carolina have no desire to put this case in front of the Supreme Court.  They have the ruling they want right now, from the 4th Circuit.  They risk the Supreme Court ruling in favor of discrimination if they swing for a precedent-setting determination in this case.  NC Republicans in Congress say the case should go forward, the governor and the AG are understandably reluctant to move it forward, and the Court has refused to hear it on the basis of that legal wrangling alone, not because of the merits of the case.  So this issue isn’t decided for the country, but for North Carolina it’s dead for at least another election cycle until there’s enough Republican support from top to bottom to write new legislation to keep Democrats out of the voting booth.  It’s a win on a technicality, but we gotta take what we can get at this point." True text
rafi-dangelo 160633104400 "2017-05-13 21:29:02 GMT" http://soletstalkabout.com/post/160633104400/happy-mothers-day-yall "After my mom died, I usually got a call from my sister on Mother’s Day just to chit chat and check in to see how I was doing.  Since this is my first Mother’s Day without either of them, I wanted to jot down a little memory of the three of us…(and then hibernate for the rest of the weekend because I’m not ready for pictures from everybody’s Mothers’ Day brunches).Brief History for the new folks and those who don’t know me.  My sister’s mom died when she was three so my dad raised her as a single father for the most part.  He was dating my mom off and on for the better part of a decade when I came along unexpectedly.  After I was born, the two of them still waited to marry each other until I was in first grade, but by then my sister was in college.  I never actually lived under the same roof with my mom, dad, and sister at the same time, and because of that, most of my Family Memories with my sister were with both of my parents, not just one or the other, since she was either home for summer break or a quick visit, or we had planned a whole vacation to visit her in Florida where she lived.History over.My sister was home visiting one summer and she had a boyfriend back in Florida that she’d met in school.  I was the quintessential nosey little brother and I used to snoop like crazy.  I read her diary, made copies of her CDs, tried on her shoes, etc.  My snooping is the reason my first “chapter book” was A Lesson Before Dying by Ernest Gaines and not something like My Teacher Flunked the Planet or Goosebumps because I was going through her shit and saw a book that looked interesting.Note to parents:  Don’t let your young kids go through your older kids’ stuff.  No seven year old really needs to be reading about race relations in 1940s Louisiana.  And I’m sure that little tidbit about myself is another piece of the puzzle for you guys.Anyway, I was a night owl (still am) and I would regularly get up in the middle of the night, make a snack, and sneak into the family room to watch cable (mostly Skinemax, I can admit that now).  One night, I heard my sister talking to someone in her room, and since I knew there wasn’t an extra person in there, I figured she was on the phone.  I went to the family room with my snack – Ritz crackers, JIF peanut butter, and sweet tea, which is still my go-to midnight nosh – and picked up the extension so I could eavesdrop.Now, lemme tell you something about my mother.  She is literally the lightest sleeper I have ever met in my life.  A cat could fart next door and she would be wide awake from a dead sleep.  I got really good at sneaking around and making no noise, but sometimes my mom would catch me in the middle of the night watching TV.  However, she was never able to catch me watching Skinemax because one of the floorboards in the hallway squeaks, and since I watched the TV on mute (obviously) I could hear her long before she was close to the room.  Then I would just flip to Headline News or something and put the subtitles on.  I was not listening for my mom on this night because I was listening to my sister’s conversation instead.  I didn’t hear her sneak right up on me and LOUDLY ask “Boy what are you doing?”  I dropped the phone and mentally prepared myself for this inevitable spanking all at the same time, while my sister was barreling down the hallway because of course she heard all of that on her end.I was already crying before they could start yelling tbh.  I was not trynna get beat at midnight by TWO angry Black women and I’m sure I saw my life flash before my eyes.  The lecture that followed was a mixture of privacy, being nosey, being bad, sneaking, and lying, but I didn’t catch a beatdown, praise God.Fast forward to the next morning.  I don’t remember where my dad and sister were, but I remember I was sitting at the bar while my mom made breakfast.  She was talking about something I don’t remember and then just casually slid into the conversation, “So what was your sister talking about on the phone last night?”C’MON KWEEN!  YES MAMA!My momma was gossip queen first and foremost and I was her favorite Chatty Cathy so she knew I would spill if I had any tea.  Unfortunately I didn’t, but now y'all know where I get that from.  My momma.I just wanted to throw this out there, another little anecdote for my future kids who won’t get to meet my mom or my sister but wonder where I got All Of This from.  I like to picture them kiki'ing about how messy my life is but also lo-key stanning for me because I’m the fiercest person they knew.  I’ll be hibernating tomorrow, but I’ll go ahead and throw my Happy Mother’s Day out there, to my mom & sister, and all y'all’s too.  Drink an extra mimosa for me.  I’ll be watching Spike Lee’s filmography and trying to pinpoint where he went wrong." True text
rafi-dangelo 160627664270 "2017-05-13 18:42:31 GMT" http://soletstalkabout.com/post/160627664270/rupauls-drag-race-episode-8-recap "(Previously on RuPaul’s Drag Race.)Aja’s out of the competition and now the New York Queens have lost a member!  What a run though.  Have we ever had one city represent in the competition for this long?  So, Sasha is sad that her Brooklyn Boo is gone, but Alexis is happy to see the room thinning out because, “I know I’m the contender in this competition.”Trinity and Shea take a minute to compare track records in the competition now that Trinity has two wins, so let’s assign points to everyone real quick:Win = 3 pointsTop 3 = 1 pointSafe = 0 pointsBottom 3 = -1 pointLip Sync = -3 points8 points, Shea Coulee6 points, My Baby Valentina5 points, Alexis Michelle4 points, Trinity Taylor4 points, Sasha Velour0 points, Nina Bo'Nina Brown-2 points, Peppermint-4 points, Farrah MoanIf you want to adjust that and give Shea and Sasha only 1.5 points for their joint win, Shea still has 6.5 so, eat that Trinity.Anyway, Peppermint is sad that she hasn’t won a challenge yet because if you haven’t won by this point, why are you even here?  Farrah Benet Ramsey is more philosophical in her approach.And in case you’re wondering, yes I do hate myself a little for making that just now.A new day in the workroom and RuPaul comes in with reading glasses on.  I kind of look forward to the reading challenge just to see who’s actually witty, but these girls are just not funny!  We might as well go on ahead and give the mini-challenge win to the editors who’ll have to string together these jokes.  Plus, I know I’m way too sensitive to have a bunch of people standing around making fun of me so I’d probably fight.And…..yeah the whole thing just made me uncomfortable to watch and most of them kept harping on the fact that Shea has jacked up teeth and Alexis is lumpy.  Nina is ashy, My Baby Valentina is pretty & boring, Trinity is plastic & mean, Farrah is young & obnoxious, Sasha is poor & bald, and Peppermint needs one.Valentina won, because why not, and she gets to make the lineup for the Roast of Michelle Visage. Overly Confident Alexis says she’s fine going first or last, since those are the two hardest parts and I guess she wants to shine.  However, she’s still in her head about the reading challenge because the other queens read her about her size, but Alexis……didn’t you just say Shea was gnawing on set pieces?  Body is something you can actually change relatively cheaply, but with lots of effort and determination.  You’re stuck with your teeth unless you have a whole lot of money to fix them, and Shea isn’t in the corner crying about something she has no control over.  However!RuPaul comes in with Ross Matthews and during their little convo with Alexis, she says that the other girls knew about her body image issues and it was something they had all discussed.  So I see her point. If someone says they’re insecure about their body and that they’re struggling with it, why would you make fun of it?  Especially when there’s so much more to work with.Of course RuPaul Andre If You Let Words Hurt You That’s Your Own Problem Charles just disregards that part of the conversation, where Alexis points out it’s a sensitive issue for her that she’s talked about with the girls, and boils it down to Alexis making fun of others but others not being able to make fun of Alexis.Farrah gets a little consult where she says she doesn’t want to be mean because it doesn’t come naturally to her, so Ross gives her some advice there since his brand is also pretty upbeat and jovial.  Let’s see if she takes that advice to heart.Peppermint is funny, but she hasn’t been very witty at all, so who knows how this roast is going to turn out for her since that’s not part of her personality or her act. And Sasha is intellectual so nobody knows how that’s going to translate into roasting a very average “celebrity” to a room of very average people.So the bottom two and the winner are all in that consultation edit with Ross and Ru, obviously, because that’s how the show works, and you might as well call Farrah for the bottom two.  Is this the week she finally goes home?This week’s Backstories While We Beat is super short and centers on Peppermint being detained in Russia 8 months ago.  (The show was shot in 2016, so I’m guessing it was the tail end of 2015 or the very beginning of last year.)  She was presenting as female, which is actually illegal there, but her ID says male, so the agent at the airport flagged her and she was detained.  She took her wig off in line to prove her identity matched the one on the ID, but Peppermint says that still doesn’t take away her womanhood.  Werq, Miss Agnes.I’m here for these glimpses into her trans identity.Time to see what tired jokes these queens wrote about Michelle Visage.  But!  Before we get into the roast, please get into Tamar Braxton’s beat for this episode!!  Refresh your memory with this snap from her last appearance.God bless a drag reality show for forcing you to step up your contouring game!(Try to ignore whatever is going wrong with her weave closure and I’ll try to ignore everything that is going wrong with your life as well.)Anyway, there’s no runway challenge this week, so I'ma throw some pics in here with the queens’ best lines from their performance.Shea Coulee had a few predictable lines about Michelle Visage being a slut (why is that always the go-to? did I miss a tell all biography or something) but she killed me with her closer.If you liked my performance, my name is Shea Coulee.  And if you hated it, my name is Nina Bo'Nina Brown.Sasha Velour just keeps surprising me!  She read everybody on the stage before she hit me with her Jersey Jokes.Michelle is so Jersey her idea of classical music is Lisa Lisa.To get that reference probably takes a certain level of familiarity with 80s pop culture, but I just tweeted a video from Lisa Lisa earlier this week because my neighbor was jamming to it, so it was right in my ballpark.  YAAAAAAAAAAAASSSS!  I used to LOVE this song.  I don’t think I ever knew who it was by. https://t.co/Gq0obhWQkA— Marine Le Flop (@RafiDAngelo) May 11, 2017 Plus, this look is kind of everything and I’m finally getting into her style.  I have to add one more from Sasha while she was introducing the next queen:A queen who combines all the excitement of smiling with the thrill of just standing there, give it up for Valentina!Valentina committed to her Latina Peg Bundy, but she didn’t really deliver anything.  She kind of hit once.Michelle is such a cochina, she can say and spell harder in six different languages.Trinity Taylor’s only successful joke landed because of her costume and because Valentina was up before her.Thank you, Pedro.  Moh-wee, bee-yin.Farrah Moan landed zero punchlines because she’s a complete waste of space in this competition.  She is very lucky Tamar didn’t go straight Baltimore on her ass because she did not sign up for this at all.Tamar Braxton.  She’s Toni Braxton’s less talented, more annoying sister.GIRRRRRRRRRRL!Thank GOD she bombed in such an epic fashion.  There’s no way she’s escaping the bottom two.Peppermint came out and slayed!  Who knew she had all these jokes in her!  Every punchline landed, her energy was right, and her delivery was perfect.  Not since Destiny’s Child has a Michelle become so famous for riding someone else’s coattails.She definitely made up for that disastrous snatch game where I just wrote her off as a bubbly entertainer with nothing to say.Nina Bo'Nina Brown came out in character, which was very smart, because it forced her to speak more slowly and it gave her a funny place to launch from.  None of her jokes really landed, but she did give me my biggest laugh of the night when she looked at Fortune Feimster and, in her nice-nasty old Black Southern woman way that we all know, asked:What’s your name baby?I didn’t know either!  I had to look her up just now in order to get her name correct for this lil recap.Alexis Michelle’s Elphaba from Patterson New Jersey who didn’t paint her feet was the most uncomfortable thing I’ve seen on the show this season.  I don’t have to say anything.  You can just look at the reactions.Clearly she’s in the bottom, and though I’ve seen her live and it’s nothing overly impressive or exciting, Farrah is literally a waste of time and Alexis should easily out lip-sync her.Before the judges critiques, Valentina and Nina Bo'Nina Brown Earl Jones are both safe, which is totally acceptable.  They both landed like one good joke and that’s it.Shea is in the top because she opened the show with the right tone, energy, and laughs.  Sasha is in the top because she was able to show what a roast would like like from her very specific kind of POV.  Tamar said “she was really smart about being smart” which really is a breakthrough, because y'all know I thought her intelligence and intellectualism (<– actual word, I’m smart too, hoe) would ultimately defeat her.  Peppermint rounds out the top three because she had the best energy and the best jokes and none of them fell flat.  The judges say that’s the best she’s ever looked, but she looked like a very dated drag queen from a 2003 pageant to me so I’m not sure what curve they’re grading her on.None of Trinity’s jokes landed, so she’s in the bottom.None of Farrah’s jokes landed, so she’s in the bottom.None of Alexis’ jokes landed, so she’s in the bottom.Trinity got saved from the bottom two because she came out in a character that did manage to garner a few chuckles, so it’s Farrah vs. Alexis for the lip sync which was WIGGITY WHACK WHACK WHACK.  Alexis won, because look who she was going up against, but can we get into this lo-key shade from RuPaul toward Tamar?  Whenever a guest judge is a musician, the lip-sync done to something from their discography.  This season we’ve had Meghan Trainor and the B-52’s, but for Tamar’s episode, the lip sync was to Dolly Parton.  And let’s not say it’s because none of Tamar’s songs are recognizable enough since I for damn sure had never heard that Dolly song.  Plus, the last time Tamar was on the show as a judge, the girls faced off to Michel'le “No More Lies” and I’m positive the vast majority of the viewing audience has no idea who Michel'le is (or how to pronounce it correctly).The next time y'all have Tamar Braxton on the show, you better have a song queued up from her album.  I’m proposing “Catfish”or “Tip Toe.”Anyway, that’s that, and after this week, Sasha moves up for me once again.  She’s a lot more well-rounded that I gave her credit for at the beginning.5. Peppermint4. Valentina3. Nina2. Sasha1. Shea" True text
rafi-dangelo 160625179565 "2017-05-13 17:14:49 GMT" http://soletstalkabout.com/post/160625179565/arguing-online "This happened to me again for the umpteenth time this morning.Anonymous: I disagree with you.Me: [provides source]Anonymous: You’re still wrong.Me: Did you read the article?Anonymous: The article can say what it wants. I probably know more about this than the author.  Believe what you want.Me: Thanks, I’ll believe the journalist who was interviewing the subject of this disagreement over an anonymous commenter on my Facebook page." True text
rafi-dangelo 160602651005 "2017-05-13 00:42:59 GMT" http://soletstalkabout.com/post/160602651005/wendi-wright-tried-to-run-her-congressman-off-the "A woman found herself behind bars after she followed a congressman from an agricultural meeting, according to Weakley County Sheriff’s Department.Wendi L. Wright, 35, faces charges of felony reckless endangerment after investigators said she trailed Congressman David Kustoff and his aide, Marianne Dunavant, down Highway 45 in Weakley County on May 8.“What she was saying was more cursing at the congressman and his aides,” Sgt. Marty Plunk said. “But, I think the basis of all of it was a health care vote that he had cast that she was upset with.”Recently, Kustoff voted to repeal Obamacare and replace it. (cont. WMCA News) Desperate times call for desperate measures I guess!  I’m 100% not in favor of violent actions in the name of politics and I think the Wendi Wrights of the world do far more harm than good.  However, I would like to point out this hypocrisy real quick.If you read through the comments about this story all around the Internet, you’ll see smug Conservatives talking about violent Liberals or calling out Liberal commenters for being in favor of Wright’s actions.  Wright put a congressman’s life in danger.  And that congressman voted to put millions of lives in danger.  Sooo….It’s not a tit for tat, but I really don’t want to hear any arguments from the Right about safety or violence when the Republican Party is intent on writing death certificates for anyone who can’t afford to pay for health insurance or decent care.Meanwhile, please don’t kill your Congressman.  Kill their career instead and find a better alternative for their post.  A felony conviction is a quick way to get yourself knocked out of the voting pool and we need to keep all the numbers we can get." True text
rafi-dangelo 160594036295 "2017-05-12 19:36:55 GMT" http://soletstalkabout.com/post/160594036295/me-after-listening-to-azealia-banks-all-day  True text
