unpretty 161061508693 "2017-05-25 16:26:23 GMT" http://unpretty.tumblr.com/post/161061508693/here-are-the-jewish-people "particularlyparasitic: watchingthedetective:  wendynerdwrites:  Western popular concepts of Jews that people here take as the extent of our tribe: The reality: Boys from the Jewish population of Yemen, which has been around for 2500 hundred years but has been slowly massacred over the past few generations. The Lemba of South Africa and Zimbabwe (Zimbabwe in particular has a large and VERY long history with their Jewish Community) The Abayudaya of Uganda, some of the great Jewish musicians The Beta Israeli of Ethiopia Igbo Jews of Nigeria Cochin Jews of India  Baghdadi Jews Kaifeng Jews of China, who go back to the 7th or 8th century. Unfortunately, during the 20th century much of their culture was almost wiped out and the Kaifeng are currently working to rediscover their Jewish heritage and culture. Jewish Children in Puerto Rico (Jews have been in Puerto Rico since the 15th century, many fleeing from the Inquisition) The Beit Shalom Choir in Japan Kosher comes in all colors, from all over the world, and in a variety cultural groups. We’re a small portion of the human population, but we have EVERYONE. We are all members of this tribe. Because stereotypes are bullshit.  Boosting because you sure as fuck won’t see this in any Western textbook.   Shoutout to the regularly erased JOC " False text
unpretty 161060134072 "2017-05-25 15:34:47 GMT" http://unpretty.tumblr.com/post/161060134072/sexaulity-writeasrayne-sexaulity-is-this "sexaulity: writeasrayne:  sexaulity: Is This Actually Funny or Am I Just Sleep Deprived? A novel by me Chances Are It’s Not, But At Least I’m Happy. The sequel.  …this was such a wholesome addition….thank u " False text
unpretty 161058951531 "2017-05-25 14:48:59 GMT" http://unpretty.tumblr.com/post/161058951531/wicked-bitch-of-thewest-casualcurses-may-the "wicked-bitch-of-thewest:  casualcurses: May the thin line of dust never brush into the dustpan. This curse is not casual. This is the sort of curse that is only mentioned in hushed whispers, if at all. The sort of curse that is so wretched, you must defeat a many headed hydra,  then pass Twelve Dread Trials simply to read it, and you only do so with the knowledge that it may melt the flesh of your face off like it was an Unholy Ark. The knowledge is Too Much. None should have this power " False text
unpretty 161058582763 "2017-05-25 14:34:02 GMT" http://unpretty.tumblr.com/post/161058582763/idea-option-to-replace-the-standard-youtube "idea: option to replace the standard youtube progress bar with one that doubles as an audio waveform so i can see when a motherfucker’s about to scream and turn the volume down" True text
unpretty 161057914428 "2017-05-25 14:06:47 GMT" http://unpretty.tumblr.com/post/161057914428/mitsurugireiji-mitsurugireiji-so-let-me-get "mitsurugireiji: mitsurugireiji:  so let me get this straight: the UK is very pointedly saying ‘please do what you have always done in these situations where a terrorist attack has happened on British Soil and keep the sensitive intelligence we entrusted to you quiet until we give you the go ahead. and trump’s government has leaked pretty much everything to the press, thus hindering the investigations here to the point where our home sec has had to censor intelligence we’re now giving the US, our closest ally w o w  okay a lot of people don’t know what i’m talking about, so here’s a link but the main gist is: trump’s government has leaked to the US press, and thus the world: - the name of the bomber- the fucking forensic photos from the investigation these may seem like small things but first off: - our government didn’t want to name the bomber until thursday/tuesday, so they could continue their investigation without alerting anyone he may have been working with- they also didn’t want the media hanging around his family or his flat, which they ended up doing- they’re the fucking forensic photos of evidence, still covered in blood, is there no such thing as tact our home sec has been forced to now censor all further intelligence we give to the US on this matter, and has released [what i may call, light heartedly, the most british angry political statement i’ve ever read]   “The British police have been very clear that they want to control the flow of information in order to protect operational integrity, the element of surprise. So it is irritating if it gets released from other sources and I have been very clear with our friends that should not happen again.”  so in the past two week slaone, trump’s government has managed to reveal intelligence from israel and the uk, two of their closest political and military allies. i reiterate: w o w " False text
unpretty 161057846553 "2017-05-25 14:03:50 GMT" http://unpretty.tumblr.com/post/161057846553/hollywood-hire-me-i-fixed-the-new-mummy-movie "aw-hawkeye-no: Tom Cruise and Young Hot Blonde™ enter the crypt, Tom in the lead because he is the manly protector. Their flashlight beams eventually illuminate a sarcophagus carved in the likeness of a beautiful Princess.  Tom Cruise approaches the sarcophagus, moves to open it.  Young Hot Blonde™: Don’t do the thing. Tom Cruise: I’m going to do the thing. *Shoves sarcophagus open* They cough as dust fills the air. Just as it begins to clear, Brendan Frasier shoots upright, drawing his gun and immediately shooting Tom Cruise in the head. “I thought I told Evy not to put me down for mummification,” he mutters as he looks at his surroundings. He is inexplicably not decomposed or mummified, just vaguely wrapped in Charmin. Glances at a now very dead Tom Cruise. “Oops.” Young Hot Blonde™: How… how did this happen? Brendan Frasier: Well, it’s a long story, I’ll have to start at the beginning. Then they just replay the entirety of ‘The Mummy’ (1999). After credits scene: Young Hot Blonde™: That still doesn’t explain how you ended up alive in a sarcophagus in the year 2017. Brendan Frasier: Oh, yeah, no fucking clue.  " False text
unpretty 161057800508 "2017-05-25 14:01:47 GMT" http://unpretty.tumblr.com/post/161057800508/hooligan-nova-hooligan-nova-regular "hooligan-nova:  hooligan-nova:  Regular person: “Could you take off your shoes before entering my house?” Anti-SJW: “WHY? DOES IT ~TRIGGER~ YOU? WHAT IF I JUST WALK IN SOME MUD AND WALK ALL OVER YOUR CARPET??? ARE YOU ~TRIGGERED~ NOW? AM I ~TRIGGERING~ YOU???”  Regular Person: “No, I’m just not going to invite you over here anymore.” Anti-SJW: “Why do you hate free speech???” " False text
unpretty 161057493483 "2017-05-25 13:49:02 GMT" http://unpretty.tumblr.com/post/161057493483/kaylapocalypse-lesmiserabelles-i-want-a "kaylapocalypse:  lesmiserabelles:  i want a modern-accent-accurate version of the arthurian myth. guinevere with a welsh accent, arthur with a midlands or northern accent, lancelot’s french, all the orkneys are scottish… how much better would mordred be as a character with a scottish accent? “a asked ma maw if arthur was ma da or ma uncle an she went tae me ‘yes’. a canny deal wi this am gonnae blow the whole kingdom up tae fuck”  I’m crying. I’m going to screenshot this and send it to my professor  " False text
unpretty 161042125153 "2017-05-25 02:09:47 GMT" http://unpretty.tumblr.com/post/161042125153/giroshane-writing-prompt-s-you-were "giroshane: writing-prompt-s: You were accidentally born into the dev build version of Earth, and you can use commands to hack the “game”. Describe your life. How your backyard barbecue go, The Smiths? Pretty good, it doesn’t seem. Ha ha. I tell little joke. next time you invite Pam. " False text
unpretty 161040234668 "2017-05-25 01:06:10 GMT" http://unpretty.tumblr.com/post/161040234668/the-unfortunate-thing-about-the-guy-bodyslamming-a "the unfortunate thing about the guy bodyslamming a reporter is that it will probably make him more popular with his shitty base" True text
unpretty 161039576780 "2017-05-25 00:43:23 GMT" http://unpretty.tumblr.com/post/161039576780/jean-grantaire-i-had-a-dream-about-bakeoff "jean-grantaire: I had a dream about bakeoff except they were all cooking increasingly weird stuff until they got to the last guy and Paul asked ‘what are you serving’ and his response was just ‘these hands’ and then he knocked Paul Hollywood out on national television" False text
unpretty 161035579185 "2017-05-24 22:25:52 GMT" http://unpretty.tumblr.com/post/161035579185/when-the-tum-is-soft "badpearl:reblog if u agree" False text
unpretty 161035263893 "2017-05-24 22:15:23 GMT" http://unpretty.tumblr.com/post/161035263893/are-you-feeling-kind-of-down-right-now-its-not "pisces-fish: rionsanura:  coneycat:  comeon-letsgoandplay:   But now you recall! Look! Look! They loves to play! Rawr! Their head is just one giant ball of floof! I can’t even How do they live? Being so cuTE?? Ugh!! This has been a PSA. Baby cheetahs are everything good and pure in this world. Please imagine petting the floof head. Please feel better.  For anyone who needs this.   Also, when they are a little older, they have full-body mohawks!  I honestly  needed this. " False text
unpretty 161034579908 "2017-05-24 21:53:13 GMT" http://unpretty.tumblr.com/post/161034579908/i-was-laughing-with-someone-recently-about-tumblr "i was laughing with someone recently about “tumblr user unpr*tty” and this seems like a good time to remind people that there is literally no point in censoring yourself if you wanna talk shit because i can’t vanity search, if i try it’s nothing but tlc lyrics and a k-pop competition of some kind. this is also why you have to @ me if you wanna show me something and we’re not mutuals." True text
unpretty 161034180717 "2017-05-24 21:40:17 GMT" http://unpretty.tumblr.com/post/161034180717/frogyell-man-ur-such-a-pussy-a-jock-says-to "frogyell: “man ur such a pussy” a jock says to me. i laugh. “well,” i begin, looking up at him and popping the collar of my jean jacket, “like they say,” everyone waits in anticipation, “u are what u eat.” the jock dies instantly, the crowd cheers, obama is there," False text
unpretty 161033240328 "2017-05-24 21:10:15 GMT" http://unpretty.tumblr.com/post/161033240328/theawesomeadventurer-nonamecody "theawesomeadventurer:  nonamecody:  theawesomeadventurer: if someone cums in space did they astronut? Outer space is my kink, it cosmanut  you son of a bitch. you’re promoted. take my keys go home and fuck my wife " False text
unpretty 161032766118 "2017-05-24 20:55:10 GMT" http://unpretty.tumblr.com/post/161032766118/kiriamaya-just-so-you-know-there-are-now "kiriamaya: Just so you know, there are now fake/troll “TERF blocklist” posts (made by TERFs themselves) that have my and other trans women’s names on them. (Actually, this may have been going on for a while and I only just now noticed it, but still.) If you’re going to reblog lists like that, please make sure they’re genuine first." False text
unpretty 161032609633 "2017-05-24 20:50:12 GMT" http://unpretty.tumblr.com/post/161032609633/justonepurpose-do-exclusionists-really-believe "justonepurpose: “Do exclusionists really believe that there is a network of pedophilic advocates who all cheer each other on and normalize this behavior?“ No, they don’t believe that. I can nearly guarantee you that most of the REGs who are doing this – who are making these bullshit callouts, who are building these huge smear campaigns – don’t actually believe that there is a “network of advocates for pedophiles” among the inclusionists. But we started no-platforming them. We started ignoring them. For many of us inclusionists, the discourse had died down because we had stopped engaging with exclusionist’s toxic bullshit.  What better way to make noise than to use an accusation that would get people, even people uninvolved with discourse, to spread these massive callouts with misinterpreted receipts? To mass block and harass people? What better way to paint aspecs and inclusionists as abusers than to use a word that makes everyone’s knee-jerk disgust reaction fire? What better way to make themselves relevant again than to make themselves out to be the protectors of children and csa survivors? What better way to force inclusionists to pay attention to them again, than to accuse them of being something they can’t possibly ignore? That they have to combat, or they’ll be painted as Guilty by Silence?  The whole thing falls apart quickly, of course, if you actually read the receipts…but many people won’t do that. And they know that. They know that people won’t want to dive through dozens of posts to see if any of them are true, but that they’ll feel guilty if they don’t reblog it just in case there’s dangerous people up there. But when you look at the discourse. When you look at how REGs have harassed, misgendered, misinterpreted, lied, sent fake screenshots, doctored screenshots, mocked people for their disabilities, mocked people for their triggers, mocked people for the words they’ve chosen to ID with, told people that their abuse didn’t happen the way they remember, told people that their abuse outright didn’t happen, posted porn and suicide baiting in the ace positivity tags, actively tried to erase history to make themselves seem correct, exposed themselves to be biphobes, transphobes, TERFs, and TRUSCUM, harassed people (even minors!) to the point of mental breakdown and even suicide attempts, erased Aspecs of Color, used Autistics as pawns, implied that all inclusionists are “cishet” even though a ton of us are neither cis nor het, implied that aspecs are inherently homophobic for just existing, implied that we’re the reason for other tags being wiped, actively wished violence against us, made us out to be an oppressor class so that we’re “easy” to bully…. The list goes on. But when you see this list, this minuscule example of just what I’ve seen and what I can remember….Those of you who are still uninvolved, I really need you to think. Even if you don’t think aspecs are LGBT+. Even if you don’t think aspecs are marginalized. Even if you actively hate me, or anyone who is currently being smeared. Are these really the kind of people you want to support? Are these the kind of people you want to trust? Can we really look at what they’ve done and think this is no more than just an internet debate?  This isn’t just petty discourse. These accusations could ruin lives. These accusations, these false accusations against many people who have victimized by pedophilia, are not a little joke. This is hurting real people. People who have already been hurt by the very abuse that REGs are claiming they are sympathetic to.  And I know this whole post reads vaguely like propaganda, I know it may seem like I’m making a lot of leaps in judgement by saying that REGs are making these false callouts with the express purpose of slandering inclusionists instead of alerting people to real, dangerous individuals. But I don’t think it’s that much a leap, mostly because of a one fact: A few people, otherwise not involved, have come forward to ask that people not group csa survivors and pedophile apologists…only to find themselves added to the list as a “pedophile apologist”. The very request that people not group victims of pedophilia in with pedophiles is enough to warrant someone being a pedophile apologist. That fact proves that it’s about slander, not safety.  And it’s because of this that I have this request: Please, for the love of god, read the receipts – all of them – on callouts you see. If you have questions, message the people. Ask them for clarification especially if you can search their blog and find that they are queer, trans, or a csa survivor.  There are real pedophiles on this site, but these lists are making it ten times harder to know when accusations are legitimate. My inbox is open, though not to anons. Not about this. I will personally clarify anything having to do with these “receipts” against me, and I’m sure most people on the list would do the same.  …this got really long, so I’m sorry. I’m having a lot of thoughts about this situation. About how in order to defend myself as an aspec, I have to deal with people abusing me this way. About how I want to stop dealing with this but can’t. About what to do. Don’t worry, followers, I have no intention of deleting or anything like that. I just…have to think about how to deal with this in an appropriate and healthy way. Because just making posts and hoping that people will read them and understand, hoping that enough people will call out these REGs making these lists, isn’t working. I’m just a small blogger, and that one list has about 400 notes now – 400 people who probably haven’t read the receipts and are just spreading these lies. It hurts me, personally, but it hurts me for the CSA survivors on the list more. I can’t imagine what it’s like for people who have been abused in such a way to see people claiming they sympathize and even advocate for the people who abused them. And for other people to believe them and spread that lie without even checking their blog. I can’t imagine how that must feel.  And I’m just sorry. I’m so sorry that this is happening. That the same people keep getting abused over and over again because they happened to be vocal about Ace Discourse™.  And I’m tired. I honestly can’t believe that there are people out there who would stoop so low as to paint abuse victims as the abusers, to lie and smear and slander…and pretend like they’re in the right.  End point: Please read the receipts of callouts before you reblog them. Please ask people for clarification if you feel comfortable and safe in doing so. Think critically about who’s posting these lists, who’s on them, and what benefit such accusations may have. Because REGs are using ignorance to actively abuse vulnerable people…so we have to be more vigilant.  " False text
unpretty 161031234343 "2017-05-24 20:05:47 GMT" http://unpretty.tumblr.com/post/161031234343/what-the-fuck-just-happened-to-my-activity-page "what the fuck just happened to my activity page" True text
unpretty 161030962043 "2017-05-24 19:57:52 GMT" http://unpretty.tumblr.com/post/161030962043/gayaiolia-just-so-people-know-marawi-is-also "gayaiolia:just so people know, marawi is also known as ‘the islamic city of marawi’; isis is attacking one of the most heavily muslim populated cities in the philippines. don’t go off on any islamophobic bullshit about the current situation. please keep everyone in your thoughts and prayers. " False text
unpretty 160918840103 "2017-05-21 19:32:51 GMT" http://unpretty.tumblr.com/post/160918840103/the-fbi-faked-an-entire-field-of-forensic-science "greenatlas:  “‘Of 28 examiners with the FBI Laboratory’s microscopic hair comparison unit, 26 overstated forensic matches in ways that favored prosecutors in more than 95 percent of the 268 trials reviewed so far.’ The shameful, horrifying errors were uncovered in a massive, three-year review by the National Association of Criminal Defense Lawyers and the Innocence Project. Following revelations published in recent years, the two groups are helping the government with the country’s largest ever post-conviction review of questioned forensic evidence. Chillingly, as the Post continues, ‘the cases include those of 32 defendants sentenced to death.’ Of these defendants, 14 have already been executed or died in prison.” Let this sink in for a minute. " False link
unpretty 160915646488 "2017-05-21 17:51:41 GMT" http://unpretty.tumblr.com/post/160915646488/lesbian-escapes-russia-by-boat-and-sails-to-canada "angryirene:  quickweaves:  girlsmoonsandstars: dear goddess let there be a movie I AM LIVING  Folks this is a beautiful story but these two women need help. She has NOT found a safe haven in Canada. It’s been 10+ years since Elena (the Russian) arrived in Canada. At first she was declared a refugee and was granted asylum. Over the last several years she has been fighting with the Canadian government to become a citizen (as she is the spouse of a Canadian citizen), and has run into about a million bureaucratic and incompetent hurdles, the result of which is that she is now a stranded and stateless person through no fault of her own. Her partner has prepared a press release (http://www.cadenza.ca/index.php/en/news/#pressrelease) that contains the full story. Please read it, and do what you can for them - I don’t know of a way to donate to them, but at the very least spread the word. If you’re Canadian, please RAISE HELL about this. " False link
unpretty 160803834013 "2017-05-18 14:22:25 GMT" http://unpretty.tumblr.com/post/160803834013/congress-just-gave-trump-awful-news-about-his-next "the-privateer:  elfgrove:  machine-dove:   Rep. Ted Lieu (D-CA) has formally introduced a bill into Congress that would require Trump to reimburse the government for funds spent on travel to his own properties, such as Mar-a-Lago in Florida and the Trump National Golf Club in Bedminster, NJ. Lieu’s bill, the Stop Waste and Misuse by the President (SWAMP) Act, states that Trump’s travel “results in the American taxpayer effectively subsidizing the president’s businesses.” The bill would also require that Trump reimburse the government for Secret Service costs derived from visits to his properties.   This should be a no brainer to pass, even for this GOP lackeys.  how fast do you wanna bet that the GOP will strike it down because it’s hurting their precious party " False link
unpretty 160718090333 "2017-05-16 03:04:34 GMT" http://unpretty.tumblr.com/post/160718090333/stones-have-been-popping-out-of-people-who-ride "kawuli: kawuli:  kawuli:  1. Doctor finds anecdotal evidence that people are passing kidney stones after riding on Big Thunder Mountain Railroad at Disney World 2. Doctor makes 3-D model of kidney, complete with stones and urine (his own), takes it on Big Thunder Mountain Railroad 60 times 3. “The stones passed 63.89 percent of the time while the kidneys were in the back of the car. When they were in the front, the passage rate was only 16.67 percent. That’s based on only 60 rides on a single coaster, and Wartinger guards his excitement in the journal article: ‘Preliminary study findings support the anecdotal evidence that a ride on a moderate-intensity roller coaster could benefit some patients with small kidney stones.’” 4. “Some rides are going to be more advantageous for some patients than other rides. So I wouldn’t say that the only ride that helps you pass stones is Big Thunder Mountain. That’s grossly inaccurate.” 5. “His advice for now: If you know you have a stone that’s smaller than five millimeters, riding a series of roller coasters could help you pass that stone before it gets to an obstructive size and either causes debilitating colic or requires a $10,000 procedure to try and break it up. And even once a stone is broken up using shock waves, tiny fragments and “dust” remain that need to be passed. The coaster could help with that, too.” SCIENCE: IT WORKS  Update:  “In all, we used 174 kidney stones of varying shapes, sizes and weights to see if each model worked on the same ride and on two other roller coasters,” Wartinger said. “Big Thunder Mountain was the only one that worked. We tried Space Mountain and Aerosmith’s Rock ‘n’ Roller Coaster and both failed.”Wartinger went on to explain that these other rides are too fast and too violent with a G-force that pins the stone into the kidney and doesn’t allow it to pass.“The ideal coaster is rough and quick with some twists and turns, but no upside down or inverted movements,” he said. MSU Today  I just love this because it’s HILARIOUS and yet also a perfect archetypal example of The Scientific Method: 1. Hypothesis 2. Experiment 3. Results 4. Discussion  5. Conclusions 6. GOTO 1 (the scientific method is iterative, don’t forget that part) " False link
unpretty 160617504148 "2017-05-13 12:14:46 GMT" http://unpretty.tumblr.com/post/160617504148/im-facing-jail-time-after-laughing-at-jeff "cricketcat9:  thedemsocialist:  I am an ordinary person. A mother of two and a grandmother of one, I am a retired children’s librarian who loves to hike, bike, travel, pick purple wildflowers, grow cherry tomatoes, read to little kids, and dance. I shop at Costco. I love their tortilla chips and salsa. I read Lisa Scottoline, Sandra Cisneros, and Howard Zinn. I watch documentaries, rom-coms, and foreign films. I have a cairn terrier named Jinx and a grandpuppy named Mattie. I am just an ordinary person who happens to care an awful lot about peace and justice and human rights. And yet on January 10, I was arrested for laughing during the confirmation hearing of attorney general nominee Jeff Sessions. And just this week, I was convicted of the two charges I received as a result of my arrest: one of disorderly and disruptive conduct, and one of parading or demonstrating on Capitol grounds. Sentencing happens next month — I could spend up to a year in jail, or be fined, or both. Just because I let out a chuckle at a public hearing.  She was convicted. My American acquaintances who support the Orange One pretend this did not happen, in fact - that nothing out of ordinary ever happened since the elections, and I hear more and more “I don’t follow American politics”. Like hell you don’t, cowards.   " False link
