unpretty 160583437815 "2017-05-12 12:31:50 GMT" http://unpretty.tumblr.com/post/160583437815/what-is-yodas-syntax-in-other-languages "allthingslinguistic:  Sometimes people ask the best questions on Reddit:  What does Yoda’s syntax look like in non-English versions of Star Wars? For those who aren’t familiar with Star Wars (all two of you), Yoda is an alien who, when speaking English, uses what seems to be an OSV syntax instead of the traditional SVO syntax. So how do foreign translations of the script handle this? I am particularly interested in what it looks like in non-SVO languages. Are there any translations where Yoda’s incorrect syntax is emulated by using an English-like syntax? Or are other languages’ syntax so free that mistakes in the use of case or verb conjugations must instead be used to emulate Yoda’s “alien” speech?  And some answers so far:    Czech: Free word order. Yoda speaks consistently in SOV. Interestingly enough, putting an object before a verb does sound unusual to most speakers of Czech.   Estonian: Free word order language. Yoda retains the English OSV order. This is grammatical in Estonian, but does make it seem as though Yoda is constantly stressing the object phrase as the main point of his statements. This gives his speech an unusual quality.   French: An SVO language. Yoda speaks in OSV.   German: A SVO or SOV language. Yoda brings the Object to the front (OSV), like in English.   Hungarian: A free word order language. There is nothing unusual about Yoda’s speech.   Italian: An SVO language. Yoda speaks in OSV. Note: OSV is also the syntax used in the Italian of the less-proficient speakers of Italian from the region of Sardinia.   Japanese: An SOV language. Yoda seems to use a more or less correct syntax, with a more archaic vocabulary.   Korean: An SOV language. Nothing is unusual about Yoda’s grammar.   Norwegian: An SVO language. Yoda speaks in OSV.   Romanian: An SVO language. Yoda speaks in OSV. He also places adjectives before the noun instead of after the noun, and uses an archaic form of the future tense.   Spanish: An SVO language. Yoda speaks in OSV.   Turkish: An SOV language. Yoda speaks in OSV. Note: This order is also used in classical Ottoman poetry, so the syntax may have been chosen in order to emphasize Yoda’s wisdom or age.   " False link
unpretty 160529334208 "2017-05-10 22:46:02 GMT" http://unpretty.tumblr.com/post/160529334208/cnn-exclusive-grand-jury-subpoenas-issued-in "iflewbikes: misandroid: … welp! " False link
unpretty 160494083473 "2017-05-09 22:54:41 GMT" http://unpretty.tumblr.com/post/160494083473/an-african-american-jockey-hasnt-won-the-kentucky "rafi-dangelo:   As jockeys who weren’t black saw African-American jockeys making a good living off of horse-racing, Murphy was an example of someone who became “a victim of his own success,” says Pellom McDaniels III, author of The Prince of Jockeys: The Life of Isaac Burns Murphy and an Assistant Professor of African American Studies at Emory University. In the 1890 season, Murphy was accused of being an alcoholic and drunk on the back of a horse. McDaniels says that, in his research, he discovered that Murphy was actually drugged. Many black jockeys were sabotaged, to the point where, by the early 20th century, they were becoming more of a rarity in the sport. Jimmy Winkfield was the last African-American jockey to win the Kentucky Derby, in 1902, and he ended up going to Europe and making a name for himself in Russia, France and Germany. (cont.)  Former slaves and immediate descendants knew the horses and took care of them, naturally becoming jockeys. Black jockeys were making way too much money and white people wanted in. Black jockeys were drugged and sabotaged, and now there are no more Black jockeys. The older I get, the more amazed I am that these little nuggets of America Ain’t Shit keep crossing my path. Things I never even imagined just weaving themselves into the tapestry of white men doing whatever they could to keep every other group underfoot. " False link
unpretty 160414743473 "2017-05-07 19:34:43 GMT" http://unpretty.tumblr.com/post/160414743473/the-long-lucrative-right-wing-grift-is-blowing-up "garbagefingers: heyitsangryangel:  Has anyone posted this yet? It’s phenomenal. “[…] the complete and inarguable disaster of the Bush administration—a failure of the conservative movement itself, one undeniable even to many consumers of the parallel conservative media—and his abrupt replacement by a black man, caused a national nervous breakdown among the people who’d been told, for many years, that conservatism could not fail, and that all Real Americans agreed with them. Rather rapidly, two things happened: First, Republicans realized they’d radicalized their base to a point where nothing they did in power could satisfy their most fervent constituents. Then—in a much more consequential development—a large portion of the Republican Congressional caucus became people who themselves consume garbage conservative media, and nothing else.”  Reblogging to read later, you had me at “they’d radicalized their base to a point where nothing they did in power could satisfy their most fervent constituents.” " False link
unpretty 160387537483 "2017-05-07 01:04:11 GMT" http://unpretty.tumblr.com/post/160387537483/you-could-win-25000-for-your-shakespeare-fanfic "laurabwrites:calling all Shakespeare fanfic writers! @unpretty, you probably know more folks than I do, boost the call? oh, dang!" False link
unpretty 160313678868 "2017-05-04 22:14:26 GMT" http://unpretty.tumblr.com/post/160313678868/small-twitter-thread-about-the-healthcare-bills "beesmygod:  beesmygod: here is a little explanation of why this happened, as far as i can tell. its intended to be comforting. your next step is to get mad and pack town hall meetings and let them know this was a massive failure senate wont vote on house passed healthcare bill   ¯\_(ツ)_/¯ told ya " False link
unpretty 160204141673 "2017-05-01 21:23:37 GMT" http://unpretty.tumblr.com/post/160204141673/if-they-could-pay-us-less-they-would "roguestatistician: berniesrevolution:  (Continue Reading) Happy May Day.  Click the link at the top and read this. " False link
unpretty 159915402618 "2017-04-23 22:13:44 GMT" http://unpretty.tumblr.com/post/159915402618/notorious-new-york-prison-is-reclaimed-by-the "optais-amme: babesimpson: “Wow,” she said, holding the key in her hands. “Now I’m really free.”  The prison, shuttered in 2013 after damage from Hurricane Sandy, is now on the precipice of a major transformation. No women will ever be punished inside its walls again. Instead, the building will reopen as a home for the women’s and girls’ rights movement. In 2015, the NoVo Foundation, a not-for-profit group run by Warren Buffett’s son and daughter-in-law, announced it had won the rights to restore and redevelop the former prison. The project, called “The Women’s Building,” will offer office space for organizations advocating for women and children, and will serve as a global hub for people working on those issues.  Rad. " False link
unpretty 159880938338 "2017-04-23 00:40:30 GMT" http://unpretty.tumblr.com/post/159880938338/peter-s-beagle-author-of-the-last-unicorn-is "aberrant-eyes:  …  l trouble – trouble severe enough so that, according to his friend Adrienne Leigh, it’s currently difficult for him to buy groceries.   In a nutshell, Beagle was the victim of a scammer. As a result of this, Beagle is both broke and embroiled in an expensive lawsuit. Here are three ways you can help. SHORT-TERM: Give a birthday gift directly to Peter Beagle via his paypal. If you’re known to me, contact me directly for Beagle’s email address (you can email me, or just leave a message in the comments asking me to email you; if you do that, make sure you comment using your real email address!); or you can go to Adrienne Leigh on Twitter and DM her for the email address. These birthday gifts can be used by Peter Beagle for his household’s immediate day to day needs. (And yes, his birthday is this week!) Please say “happy birthday!” in the Paypal message area. LONG-TERM:Go to the Support Peter Beagle website and use the button there to contribute to a fund to help pay for Peter Beagle’s legal costs. BUY THE HUMBLE BUNDLE!Peter Beagle has curated a Humble Bumble of unicorn fiction, called “Save the Unicorns.” You can pay as little as $1 to get a ton of novels to read, and support Peter Beagle at the same time! Important: In “choose where your money goes,” pick 100% Tachyon Press. Peter Beagle will get royalties and such from Tachyon for these Humble Bumble sales. To be kept up-to-date on Peter Beagle news, follow @RealPeterBeagle on Twitter. " False link
unpretty 159880841468 "2017-04-23 00:36:55 GMT" http://unpretty.tumblr.com/post/159880841468/the-heart-of-whiteness-ijeoma-oluo-interviews "newwavefeminism: newwavefeminism:  A great interview and wonderfully written piece on the biggest white savior culture vulture there is. Nicole Chung called it “the only thing you need to read about Dolezal ever again”. I wasn’t familiar with the work of Ijeoma Oluo but I have quickly become a superfan. The dismissive and condescending attitude toward any black people who see blackness differently than she does is woven throughout her comments in our conversation. It is not just our pettiness, it is also our lack of education that is preventing us from getting on Dolezal’s level of racial understanding. She informs me multiple times that black people have rejected her because they simply haven’t learned yet that race is a social construct created by white supremacists, they simply don’t know any better and don’t want to: “I’ve done my research, I think a lot of people, though, haven’t probably read those books and maybe never will.” I might quote this piece all night long. Please go read and then erase Rachel from your minds forever.  Can I just say everyone needs to actually click on this link and read this article? It’s the beast writing on this chick I’ve seen… ever. It also serves as a remedy for the actual pain we feel from her existence. This journalism has made my day " False link
unpretty 159879754263 "2017-04-22 23:57:42 GMT" http://unpretty.tumblr.com/post/159879754263/the-largest-historical-dictionary-of-english-slang "medievalpoc:I have a feeling a lot of my followers will find this *very* useful and informative <3" False link
unpretty 159822589143 "2017-04-21 11:06:02 GMT" http://unpretty.tumblr.com/post/159822589143/lets-print-a-comic-pdf-ebook-iron-circus "spikedrewthis: ironcircuscomics:  Hey, everyone! There’s a cool new ebook in the ICC shop!    Written by print tech Rhiannon Rasmussen-Silverstein and drawn by cartoonist David McGuire, Let’s Print a Comic (And Not Screw it Up) is 40 pages of field-tested, professional-level instructions, definitions, and advice meant for any cartoonist interested in showcasing their work on the printed page! Whether it’s your first book project or your fifteenth, full-color or grayscale, a saddle-stitched mini or perfect-bound trade paperback, Let’s Print a Comic is bound to teach you something new, up your game, and maybe even fix your pre-press problems before they start! Click here to grab a copy!  ( o_o)-b " False link
unpretty 159745451278 "2017-04-19 06:44:23 GMT" http://unpretty.tumblr.com/post/159745451278/using-our-words "elvensemi: I don’t actually have any excuse for having written a probably not even canon short story set in an AU of what was supposed to be a pwp one shot, that itself was supposed to be a pwp one shot but turned into a really big universe we have a lot of plans for idk idk idk This one’s pretty safe for work? Unreasonably long at over 7k. Little bit of flashing back to sin but no sin within the work itself. " False link
unpretty 159727867813 "2017-04-18 20:49:33 GMT" http://unpretty.tumblr.com/post/159727867813/if-it-doesnt-have-an-hea-or-hfn-its-not "thebibliosphere:  illputaspellonyou:  thebibliosphere:  dhaarijmens:  thebibliosphere:  romancingthebookworm:  I know we’ve seen this discussion pop up more than once (like the author of this piece points out, it usually cycles through every few months) but this is probably one of my favorite set-downs of the Non-HEA crowd yet.  It’s well phrased, fairly comprehensive, and just slightly scathing.  It’s the utter bane of my existence when people send me their manuscripts to edit, and I get a cover email that read along the lines of “I’m not a fan of romance novels so I added my own twist” and my soul curdles because first of all a) if you don’t like romance but you’re writing it because you’ve realized it’s lucrative and you think Anyone can do it because it’s “easy”: get the Hell out of my genre and b) suffering and misery instead of a happily ever after (or happy for now) are not twists. It’s not edgy, it’s not clever, in fact what it shows me is that you do not understand the genre on a fundamental level and shouldn’t be writing for it. Romance is a fantasy genre, people don’t read fantasy for endless suffering (thank you GRRMartin et al for making every edgelord in the world think nitty gritty detail = pain and suffering without relief and flooding the genre with their shitty reimaginings of the characters from Lord of the Rings but set to the plot of SAW) they read fantasy to know that the suffering  will end. That evil will eventually be defeated, that good things can and will still happen and that the sun will shine again. Romance is no different from that, except it is a genre primarily considered to be feminine and therefore subject to ridicule and the belief that somehow if a woman can do it, it must be easy “But Joy,” I hear some of you say, “Romance doesn’t have that reputation because of sexism, it’s because of how many bad writers get published in it and make it look bad.” *angry buzzer sound* oh I’m sorry that was incorrect, you see every genre has an abundance of shitty books that make it to print, whether it’s goofball sci-fi or Lord of the “all my characters are white because of historical accuracy” Rings 94949392.0 (or if you really want to start a fight, every mediocre white man considered a classic by the literary genre and lauded by academia for writing about wanting to have an affair with one of his students/the inevitability of death) and while they are subject to criticism, there’s still not quite the same vitriol that Romance gets for wanting, what is essentially, a happy life. There is nothing wrong with feel good media, there is nothing wrong with wanting to enjoy something a little bit silly and unapologetically happy. The popularity of coffee shop Aus in fandom is both unsurprising and nothing new. It’s quite literally common romance tropes that have been around forever but with the diversity of fandom (*eyes ao3 tag* kind of) and I will die on this hill defending the validity of Happily Ever Afters and Happily For Now before I let anyone try to take it from my icy cold grip. And if I get one more romance manuscript with a cover letter that says they’ve added a twist, then god dam y'all someone had better have twisted their ankle and been carried bridal style to their bed because I’m so over people hating on the simple want for happiness.  other acceptable twists: polyamory  And polyamory. Things I am now looking for in my romance twists, twisted ankles, polyamory and people doing Chubby Cheker’s The Twist at weddings. That is the acceptable list of twists.  Chocolate twists?  Okay, yes good. Unless your characters have celiac in which case no, I will not allow that kind of suffering. " False link
unpretty 159636763598 "2017-04-16 13:01:04 GMT" http://unpretty.tumblr.com/post/159636763598/netflix-developing-new-carmen-sandiego-animated  True link
